date,word_count,content,school
24-Jan-20,414,"The UC Santa Cruz Student Health Center offers information for members of the campus community to protect their health.

Information about the coronavirus
To: UC Santa Cruz Community
From: Gina Fleming, MD, MSPH, Interim Associate Vice Chancellor Student Health and Wellness
January 24, 2020
Dear UC Santa Cruz community,
We know that many of you are concerned about the recent appearance of the coronavirus. Although there have been no confirmed cases on campus, we want to provide you with some information about how to protect your health.  
What is the Coronavirus?
Coronavirus is a group of viruses that can cause respiratory illnesses, including the common cold. According to the California Department of Public Health, the newest strain of coronavirus started in Wuhan, China. Most patients have had mild illnesses although a few are very sick or have died. As of this morning, two people have tested positive in the United States. No cases have been identified in California.
How is UCSC Student Health Services protecting the campus community?
At the Student Health Center, we check anyone with acute illness for their travel history and/or possible exposure to the virus. We also work closely with our local public health department and the Centers for Disease Control (CDC). We follow their guidance about testing, treatment, and communications.
How can I stay healthy if I’m traveling?
CDC recommends avoiding non-essential travel to Wuhan, China. Take the following precautions if traveling to other parts of China:
Avoid contact with sick people.
Avoid animals (alive or dead), animal markets, and products that come from animals (such as uncooked meat).
Wash hands often with soap and water for at least 20 seconds. Use an alcohol-based hand sanitizer if soap and water are not available.
If you traveled to China in the last 14 days and feel sick with fever, cough, or difficulty breathing, you should:
Seek medical care right away. Before you go to a doctor’s office or emergency room, call ahead and tell them about your recent travel and your symptoms.
Avoid contact with others.
Not travel while sick.
Cover your mouth and nose with a tissue or your sleeve (not your hands) when coughing or sneezing.
Wash hands often with soap and water for at least 20 seconds. Use an alcohol-based hand sanitizer if soap and water are not available.
To avoid sickness, we also recommend getting your flu shot and staying home when you’re sick. Take care of yourself with nutritious meals and plenty of sleep. ",Santa Cruz
30-Jan-20,382,"UC Santa Cruz health officials are closely monitoring the coronavirus and, in coordination with county officials, preparing to manage any outbreaks in our campus community.
Campus health officials closely monitoring coronavirus
January 30, 2020
UC Santa Cruz health officials are closely monitoring the coronavirus and, in coordination with county officials, preparing to manage any outbreaks in our campus community.
To date, there have not been any reported cases in Santa Cruz County or in the Bay Area. There have been two confirmed cases in Southern California, and four other cases in Washington, Arizona, and Illinois.
UC Santa Cruz has an information page online at ucsc.edu/coronavirus that will be updated regularly with new information. 
Coronavirus is group of viruses that can cause respiratory illnesses, including the common cold. According to the California Department of Public Health, the newest strain of coronavirus started in Wuhan, China.
State officials report that the immediate health risk from the coronavirus to the general public is low. Federal officials recommend that people avoid non-essential travel to China. 
As with any virus, especially during the flu season, the California Department of Public Health reminds people to: 
Wash hands with soap and water.


Avoid touching eyes, nose or mouth with unwashed hands.


Avoid close contact with people who are sick are all ways to reduce the risk of infection with a number of different viruses.


Stay away from work, school or other people to avoid spreading illnesses. 


Clean and disinfect frequently touched objects and surfaces (cell phone, keyboard).


The potential threat of a novel virus can be frightening and overwhelming, with varying accounts and messages on social media and the internet.
Taking the outlined precautionary measures are the appropriate preventative measures in the event of any communicable disease. As a university, we stand to support, include, and protect our diverse and international community.
It is important to remember that isolating or assuming a certain racial group is carrying the disease is counterproductive and can cause unfounded suffering.
Campus community members who are experiencing discrimination or harassment on the basis of their nationality or race are encouraged to report incidents.
Additional information can be found at:
Student Health Center


Office of Emergency Services


Coronavirus frequently asked questions, from Santa Cruz County Health Services Agency


California Department of Public Health

",Santa Cruz
31-Jan-20,338,"Due to the dynamic situation with the coronavirus and to protect the health of the university community, the UC Office of the President has said that faculty, staff, and students should avoid all non-essential travel to China. The directive is in line with guidance from the Center for Disease Control and Prevention and the State Department. UC Santa Cruz is developing a protocol to review any campus-related travel to China. Additionally, American, Delta and United have announced that they will halt flights to China.
In order to ensure the well-being and safety of those who must travel during this time, it is of utmost importance that all faculty, staff, and students traveling abroad for university-related purposes register their international travel with the UC International Travel Registry before their expected departure and update this information as changes occur before and during travel. Registration is an important step in reducing the risks of traveling abroad and helps keep the university community safe, especially in environments with heightened health risks, such as the coronavirus.
UC Travel Insurance
Registering UC Travel
For assistance with all travel or travel insurance related questions, please contact your local Campus Risk Manager.
Automatic trip insurance enrollment
Business related travel arrangements made by UC employees can be booked through one of the two preferred Connexxus Travel suppliers, BCD Travel or UC Travel Center. The travel reservation will automatically be registered for traveler insurance coverage. Within minutes of completing the reservation the traveler will be emailed information to use in an emergency while traveling on UC business both domestically and abroad.
Register your trip with UC Away - If travel reservations are made by an agency outside the Connexxus Travel program or for Southwest Air for Connexxus (Southwest) then trip registration is required for University related trips out of state and to foreign countries. (See the ""UC Away tutorial"" link on this page for a video tutorial in using the UC Away travel registration system.)
UC Away tutorial - This video tutorial demonstrates how to register travel using UC Away.",Santa Cruz
4-Feb-20,1276,"The UC Office of the President has directed that faculty, staff, and students should avoid all non-essential travel to China. The directive is in line with guidance from the Center for Disease Control and Prevention and the State Department. The UC Santa Cruz process to determine and approve essential university-related travel by members of the UC Santa Cruz community. Read more.

Campus community members who have recently returned from China and have become ill with fever, cough or shortness of breath, should call their health care provider or local health department and be ready to share their travel history. The Santa Cruz County Communicable Disease Program can be reached at 831-454-4114 and after hours at 831-471-1170.
Updated directive on non-essential travel restrictions to CDC Level 2 and Level 3 Travel Health Notice countries
For UC Santa Cruz Community, effective February 3, 2020, updated on March 6 and March 26.
PURPOSE
The purpose of this procedure is to provide information regarding restrictions of travel to CDC Level 3 countries and CDC Level 2 countries. It provides guidance on the University of California’s Presidential Directive (1/30/2020) and a follow-up directives. President Napolitano issued a letter on March 5 further restricting international travel in accordance with recent CDC guidance. This directive expands the existing travel restriction for CDC Level 3 countries to include CDC Level 2 countries. University travel between these countries and UC Santa Cruz is prohibited without prior approval from campus Risk Services.
This remains a rapidly changing situation and any UC traveler to these regions should carefully evaluate the situation using guidance from the U.S. State Department and the Center for Disease Control and Prevention as well as information provided by WorldAware, UC’s contracted global risk intelligence partner.
BACKGROUND
Following the United Nations’ World Health Organization’s declaration of the coronavirus outbreak in China as a “global health emergency” several federal and state agencies have issued travel advisories. 
In light of these actions, the University of California has restricted University-related travel to CDC Level 3 countries and CDC Level 2 countries. These restrictions do not apply to travel that is solely personal; personal travelers should be aware of travel risks and of federal government warnings on any type of travel to/from CDC Level 3 countries and CDC Level 2 countries.
Members of the UCSC community may send questions regarding this procedure to oes@ucsc.edu, a dedicated email account that is monitored by the Office of Emergency Services.
APPROVAL PROCESS PRIOR TO TRAVEL
All UC-business travel to CDC Level 3 countries and CDC Level 2 countries is restricted until further notice. This travel restriction is also applicable to “tack-on” travel. UCSC affiliates traveling for university business to other international locations shall not add add-on visits to CDC Level 3 countries and CDC Level 2 countries.
To request approval for essential travel to CDC Level 3 countries and CDC Level 2 countries (essential defined below), university business travelers must follow the applicable approval process as outlined below. Following this process and obtaining prior approval for essential travel will be required for reimbursement of travel expenses.
Faculty, Researchers, Postdoctoral Scholars: Essential travel is defined as travel that is required to:
preserve the safety of a research subject and which is not possible to be postponed; or
preserve the results of a research activity and which is not possible to be postponed.
For faculty, researchers, and postdoctoral scholars, essential travel does not include travel to attend professional or educational conferences. Conferences are just one example of non-essential travel – other activities will also be considered non-essential travel.
To request approval to engage in essential travel, employees in this group should contact their Dean in writing. If the Dean agrees that the proposed travel should be considered essential, the Dean will consult with the Associate Vice Chancellor of Risk and Safety Services. If the Dean and AVC of Risk and Safety Services agree that the travel is essential, the Dean will confer with the CP/EVC for final approval or disapproval.
Staff: Staff travel is considered non-essential.
To request an exception to the determination that UCSC-related travel to CDC Level 3 countries and CDC Level 2 countries is non-essential, the staff member should communicate in writing with their unit’s Principal Officer. The Principal Officer will then consult with the Associate Vice Chancellor of Risk and Safety Services. If the travel is deemed essential, the Principal Officer will confer with the CP/EVC for final approval or disapproval. The CP/EVC may consult with the AVC of Risk and Safety Services.
Students: Student essential travel is defined as that which is necessary to meet a graduation requirement and which is not possible to be postponed.
To request approval to engage in essential travel, students should contact in writing the Dean of their respective division. The Dean of the relevant division will confer with the Associate Vice Chancellor of Risk and Safety Services. If the travel is deemed essential, the Dean will confer with the CP/EVC for final approval or disapproval. The CP/EVC may consult with the AVC of Risk and Safety Services.
Deans (of the disciplinary divisions, Undergraduate Education and Graduate Studies) are responsible for ensuring that students are aware of this requirement, and Department Chairs and Institute/Organized Research Unit directors are responsible for ensuring that their faculty and researchers and their labs are aware of and adhere to this requirement.
If travel is approved and deemed essential, it is of utmost importance that all faculty, staff, and students traveling abroad for University-related purposes register their travel before their expected departure and update this information as changes occur, before and during travel. Registration is an important step in reducing the risks of travelling abroad and helps keep the University community safe, especially in environments with heightened health risks such as the coronavirus.
Resource
Information and resources on COVID-19 (coronavirus) can be found at https://www.ucsc.edu/coronavirus.
Limiting non-essential travel to China",Santa Cruz
4-Feb-20,989,"To: UC Santa Cruz Community
From: Public Affairs
February 04, 2020
Share this story:TwitterFacebookLinkedInReddit
To protect the health of the university community in the midst of a dynamic situation with the coronavirus, the UC Office of the President has directed that faculty, staff, and students should avoid all non-essential travel to China. The directive is in line with guidance from the Center for Disease Control and Prevention and the State Department. 
To date, there have not been any reported coronavirus cases in Santa Cruz County. There are two confirmed cases in Santa Clara County and two confirmed cases in San Benito County. 
The UC Santa Cruz process to determine and approve essential university-related travel by members of the UC Santa Cruz community is available online. 
In order to ensure the well-being and safety of those who must travel anywhere during this time, it is of utmost importance that all faculty, staff, and students traveling abroad for approved university-related purposes register their international travel with the UC International Travel Registry before their expected departure and update this information as changes occur before and during travel. 
Registration is an important step in reducing the risks of traveling abroad and helps keep the university community safe, especially in environments with heightened health risks, such as the coronavirus. 
Campus community members who have recently returned from China and have become ill with fever, cough or shortness of breath, should call their health care provider or local health department and be ready to share their travel history. The Santa Cruz County Communicable Disease Program can be reached at 831-454-4114 and after hours at 831-471-1170. 
For more information and updates on the coronavirus visit ucsc.edu/coronavirus.",Santa Cruz
5-Feb-20,273,"UCSF is hosting a town hall today on the novel coronavirus that's open to the UC community. A panel of speakers from UCSF Health and UCSF will provide an update on the science of the virus, UCSF’s response to the evolving and dynamic outbreak, and address questions about prevention, traveling abroad, occupational and student health, and more.
UCSF Town Hall on Novel Coronavirus
NOTE: The Zoom has reached capacity. You can use this alternative link to view the livestream: https://lecture.ucsf.edu/ets/Play/3fb0baf05c6b4138b43018da79aa4a171d
 
The UCSF community is invited to a special town hall to discuss the 2019 Novel Coronavirus.
A panel of speakers from UCSF Health and the campus will provide an update on the science of the virus, UCSF’s response to the evolving and dynamic outbreak, and address questions about prevention, traveling abroad, occupational and student health, etc.
This town hall will be presented live in Byers Auditorium in Genentech Hall at the UCSF Mission Bay campus and will be presented via Zoom at https://ucsf.zoom.us/j/828668821
Panelists and topics include:
The Science of the Novel Coronavirus: Charles Chiu, MD, professor of medicine
UCSF Health Response: Adrienne Green, MD
Occupational Health: Bob Kosnik, MD
Student Health: Chaitali Mukherjee, MD, MPH
Human Resources: Jeff Chiu
Members of the audience both in person and online are invited to submit questions via the dedicated email emer.mgt@ucsf.edu or using the Zoom functionality.
UCSF is committed to making its facilities and events accessible in compliance with the Americans with Disabilities Act. If you need reasonable accommodations for this event, please contact Lisa Cisneros at lisa.cisneros@ucsf.edu.",Santa Cruz
7-Feb-20,700,"The UC Santa Cruz Student Health Center shared an update with the campus community, including additional guidance for anyone who recently returned from China. The center will be offering more flu shot clinics on Feb. 12-13 to support the community's health.Read more.
2019 Novel Coronavirus
To: UC Santa Cruz Community
From: Elizabeth Miller, D.O., Medical Director, UCSC Student Health Services
February 07, 2020
The potential threat of a new virus can be frightening and overwhelming, particularly with misinformation and rumors that can spread through our community and on the internet. This letter serves to update everyone with accurate information obtained from the CDC and state communicable disease specialists. 

UC Santa Cruz leaders remain in daily communication with health officials working for Santa Cruz County, the state, and the UC Office of the President. We have not had any confirmed or suspected coronavirus cases at UC Santa Cruz, and no confirmed cases in Santa Cruz County. However, there have been two confirmed cases in Santa Clara County and two cases in San Benito County. These four cases were placed in isolation immediately after arrival to the U.S., so the risk of spread of coronavirus from them has not been a concern. To date, California has had a total of six confirmed coronavirus cases, all doing well. 

UCSC Student Health Center leaders are committed to the health and wellness of the campus. We are prepared to support members of our campus community who may be impacted by the new coronavirus, including suspected or confirmed cases. We will continue to provide updates on coronavirus at ucsc.edu/coronavirus. Any significant changes to the situation will be shared immediately and broadly with our campus community. 

In accordance with the most recent public health guidance, anyone who has returned from China on or after Feb. 3, with or without symptoms of illness, should not go to work or school. They should go home and notify their health care provider. 

Persons who returned BEFORE February 3rd, and have been back for less than 14 days, and have become ill with fever, cough, or shortness of breath should call their health care provider and be ready to share their travel history BEFORE arriving on site in order to make arrangements to prevent possible spread of illness to others. Students who become ill should contact the Student Health Center at 831-459-2591 and ask to discuss their symptoms with a nurse. All students arriving for care at the Student Health Center are screened for their travel history and/or possible exposure to the virus. We do not have any suspected coronavirus cases at this time. UC employees can choose from a range of health care providers based on their health care plans. 

Faculty, staff and students who have returned from China BEFORE February 3rd and have no symptoms may wish to consider staying home for 14 days after they left mainland China, but it is not mandatory, and they should continue monitoring themselves for symptoms until the end of the 14 days.

As a university, we stand to support, include, and protect our diverse and international community. It is important to remember that isolating or assuming a certain racial group is carrying the disease is counterproductive and can cause unfounded suffering.

Campus community members who are experiencing discrimination or harassment on the basis of their nationality or race are encouraged to report incidents by going to help.ucsc.edu or reporthate.ucsc.edu.
We are, of course, in flu season and I encourage everyone in our community to take precautions to protect their health:

• Get a flu vaccine if you haven’t already done so.  SHS has several flu vaccine options for students. Please check the SHS website for more information.
• Wash hands thoroughly with soap and water.
• Avoid touching eyes, nose or mouth with unwashed hands.
• Avoid close contact with people who are sick  
• Clean and disinfect frequently touched objects and surfaces (cell phone, keyboards, tabletops).
• If you are sick, stay away from work, school or other people to avoid spreading illnesses and seek medical care if you have fever, severe cough or difficulty breathing.  ",Santa Cruz
7-Feb-20,359,"Students: How to get a flu vaccine
February 07, 2020
It's still flu season, but it's not too late to get a flu vaccine! Students have three options for receiving a flu vaccine. 
1. Attend a flu vaccination clinic on February 12th and 13th.
Flu vaccine clinics are at the Student Health Center Mural Room on Wednesday, February 12th and Thursday, February 13th from 9am-12pm and 1pm-4pm. You can:
Schedule an appointment for February 12-13 during the flu clinic hours above. This is the fastest option! To schedule, go to Health e-Messenger and choose “Appointments.” Choose the date you want. Show up on time for your appointment and we’ll take care of the rest. 
Walk in during February 12-13 during the flu clinic hours listed above. You may have to 10-20 minutes depending on the number of people ahead of you.
2. Get your flu vaccine on another date.
You can:
Schedule a visit for any available Wednesday by going to Health e-Messenger and choosing “Appointments.” Choose ""Flu and HPV clinic Every Wednesday starting 1/8/20"" then choose an available time. You can also call us to see if there are other appointment times available (831-459-2500).
Walk in on Monday, Wednesday, Thursday, or Friday from 8:30am-10:30am, or Tuesday from 9:30am-10:30am. We will do our best to accomodate you, but there may be a wait depending how busy the Student Health Center is.
3. Go to an off-campus pharmacy.
Where to go: Pharmacies such as Safeway, Walgreens, RiteAid, etc.
UC SHIP students: You can go to any pharmacy that takes Optum pharmacy benefits, such as Safeway, Walgreens, and Riteaid. We don't currently recommend CVS.
What to bring: Use your insurance app or your insurance card.
What it costs: UC SHIP covers these vaccinations 100%. If you don't have UC SHIP, call your insurance provider before you go to ask about costs.
What to do afterward: Let us know that you got vaccinated. To do this, you must upload the immunization record to Health e-Messenger. Log into Health e-Messenger with your gold password. From the left menu, select Immunization/TB Upload and upload your record there.",Santa Cruz
10-Feb-20,178,"Campus community members can learn more about surgical masks, dust masks, and N95 respirators, and the different kinds of protection each one offers.
Face Masks vs. N95 Respirators
Surgical masks, dust masks, and N-95 respirators each serve a different purpose in airborne contaminant protection. The following information summarizes common features and uses of each. Surgical Face Mask •Provides a barrier to capture respiratory droplets from wearer, helping prevent spread of disease.•Loose-fitting. •Does not provide the wearer with a reliable level of protection from inhaling smaller airborne particles and is not considered a means of respiratory protection. •Not NIOSH approved.Dust Face Mask •Designed to protect wearer against non-toxic irritants such as pollen, mold, grass, etc.•Similar to the surgical face mask, provides a barrier to capture respiratory droplets from wearer, helping prevent spread of disease. •Not NIOSH approved.N95 Respirator•Reduces wearer exposure to particles including small particle aerosols and large droplets. Filters out at least 95% of airborne particles.•Tight-fitting. •Only effective when fit-tested using OSHA approved methods.•NIOSH approved, double strapped, and clearly labeled with “N95.
",Santa Cruz
11-Feb-20,89,"Seven confirmed coronavirus cases (including one from a repatriation flight) have been identified in California and there are approximately 130 persons who have been tested, according to the California Department of Public Health. Additionally:
The CDC updated its frequently asked questions page.
The World Health Organization announced an official name for the disease that is causing the 2019 novel coronavirus outbreak, COVID-19. CDC will be updating its website and other CDC materials to reflect the updated name.
The California Department of Public Health issued guidance for universities and colleges.",Santa Cruz
