date,word_count,content,school
10-Mar-20,849,"In a message to campus, Chancellor Cynthia Larive announced new campus actions designed to help limit coronavirus (COVID-19) risk on campus, including that beginning Wednesday (March 11) lecture courses (including discussion sections) and seminars will be offered through alternative modalities (e.g., Zoom) to reduce face-to-face interactions as much as possible. There are no confirmed cases on campus at this time.
A message to instructors provides more guidance on delivering instruction and finals, following the chancellor's announcement to suspending in-person classes in response to COVID-19. The message was sent by Interim Campus Provost/Executive Vice Chancellor Lori Kletzer; Lindsay Hinck, Chair, Academic Senate Committee on Courses and Instruction; Onuttom Narayan, Chair, Academic Senate Committee on Educational Policy; and Don Smith, Chair, Academic Senate Graduate Council.
In addition to the adjustments in instruction and final-exam administration, and consistent with consultation with our campus emergency management experts, UC Santa Cruz is making a number of adjustments and recommendations related to campus operations.
URGENT: UC Santa Cruz suspending in-person classes in response to coronavirus (COVID-19)
To: UC Santa Cruz Community
From: Chancellor Cynthia Larive
March 10, 2020
Share this story:TwitterFacebookLinkedInReddit
Today we are implementing new campus actions designed to help limit coronavirus (COVID-19) risk on campus. Importantly, there are no confirmed cases on our campus at this time; however, we recently learned that a second case has been identified in Santa Cruz County and the number of cases in neighboring Santa Clara County continues to rise. As local, national, and global public health recommendations increasingly shift to efforts to mitigate transmission by social distancing, UC Santa Cruz is proactively taking steps to protect our campus community.

In our assessment of the current situation, we believe that this is the best action for our campus and the broader Santa Cruz community. These measures are effective beginning Wednesday, March 11, and will remain in place through the first week of the spring quarter. A decision on what will happen after April 3 and beyond for the spring quarter will occur at a later date, based on the latest coronavirus information available. Timely updates will be emailed and posted on the UCSC COVID-19 website.

INSTRUCTION
Beginning Wednesday, March 11, lecture courses (including discussion sections) and seminars will be offered through alternative modalities (e.g., Zoom) to reduce face-to-face interactions as much as possible.
Lab and studio courses that must meet in person because alternative instruction outside of the classroom is not appropriate can continue to meet in person where necessary. 
In-person winter quarter final exams will be conducted via alternate means - not in person. Instructors will be communicating with their students this week about alternative plans for assessment on a course-by-course basis.
The first week of spring quarter, Monday, March 30, though Friday, April 3, will also follow this model with lecture courses and discussion sections delivered remotely.
EVENTS
Per CDC guidance, crowds should be avoided. As such, all campus-sponsored events with plans for more than 50 attendees (based on county guidance) will be canceled or postponed. These include events put on by the administration or academic departments and scheduled to take place through Friday, April 3. Further guidance will be forthcoming regarding student organization events.
For campus-sponsored events with fewer than 50 attendees, we strongly encourage planners of those events to explore alternatives to in-person gatherings.
CAMPUS OPERATIONS

The campus is not closing. Campus buildings will remain open, and many campus operations, including student housing and dining, health services and research support operations, will continue to provide services, though some services may be modified as conditions change.

While the campus will remain open, we encourage all students who are able to do so return to their permanent residence and continue their studies remotely through April 3. We know this is not possible for all students, however reducing the number of people on campus will increase the safety of all, and allow those who remain on campus to better practice social distancing. Additional guidance about the spring quarter will be provided prior to April 3 based on the latest available coronavirus information.

Some limitations in operations and services may arise as managers may be allowing their employees to work remotely, when possible. More communications to managers and employees about working remotely will be provided shortly. In addition, a message outlining additional adjustments to campus operations, events and travel will be issued shortly.

We understand that implementing these changes with such limited notice may be challenging and disruptive, and we appreciate your patience and cooperation. The safety of our campus community is our highest priority. We are grateful to the community members throughout our campus for their tremendous efforts during these challenging times, especially our front-line staff who serve in health care, custodial, and food service roles.

We will continue to update you on this issue with the latest information on our COVID-19 webpage or the Office of the President’s COVID-19 webpage.

Please continue to look out for each other and to show kindness and support to all members of our campus community. Students, please share this message with your families and any concerned parties.",Santa Cruz
10-Mar-20,708,"To: UC Santa Cruz faculty
From: Interim Campus Provost/Executive Vice Chancellor Lori Kletzer, Lindsay Hinck, Chair, Academic Senate Committee on Courses and Instruction, Onuttom Narayan, Chair, Academic Senate Committee on Educational Policy, Don Smith, Chair, Academic Senate Graduate Council
March 10, 2020
Share this story:TwitterFacebookLinkedInReddit
Earlier today, the Chancellor announced new actions designed to help limit coronavirus (COVID-19) risk on campus. In recent days we have seen the continued spread of COVID-19 around the world and now here in Santa Cruz County. We can expect that confirmed cases will continue to grow in our region and in our campus community. There are no confirmed cases on our campus at this time.
The public health guidance we are receiving continues to emphasize not only good personal hygiene practices, but also minimizing close contact among groups of people, as means of restraining the spread of COVID-19. We are placing constraints on large public events at UC Santa Cruz, and now we are taking steps regarding course instruction.
For the final three (3) days of the winter quarter, beginning Wednesday March 11, through the first week of spring quarter, Friday April 3, we will be suspending most in-person classes and will be offering all lecture courses (including discussion sections) and seminar instruction through alternative modalities (e.g., Zoom). Wherever possible, instruction should be carried out through Zoom meetings. In addition, instructors should provide assigned course materials, including the instructor’s lecture materials, on Canvas.
During this period laboratory and studio classes can continue to meet in person where necessary. We do encourage, for these courses, minimizing in-person meetings as appropriate and whenever possible. 
To the fullest extent possible, final exams will be moving to remote instruction formats. Alternative arrangements must be made for any Winter quarter final exams that were scheduled to be administered in person, such as delivering via a remote format, restructuring as a take-home exam, or replacing with a final project.  
We recognize that this is a significant adjustment for instructors, staff, and students. Departments and instructors should work together to determine the most appropriate solutions for finishing courses and assigning grades. The March 9 message to instructors provides guidance on online instruction and assessment, and instructors are strongly encouraged to provide students the opportunity to demonstrate their knowledge at the end of the quarter. Above all, departments and faculty are asked to put student health and success first in their decision making. In that spirit, advising, tutoring, and supplemental instruction should move to Zoom format to the fullest extent possible.
For final exams and end-of-quarter assessment of student performance, instructors may also need to consider options such as: electronic submission of final papers, projects, and take-home examinations; and proctored online examinations.
If a student is not able to complete the option(s) provided by the instructor, the student may be given an incomplete (I) at the student’s request if their work was of passing quality but incomplete. Instructors should be clear as to what needs to be done within the next quarter to remove the incomplete. The March 6 Academic Senate message noted that instructors may not be able to satisfy all the learning outcomes of their course, and that student assessment may not be in accordance with the grading plan laid out in the syllabus provided at the beginning of the course. If necessary, faculty should consult with their department chairs in determining the most appropriate actions to take. 
We are committed to providing support to help instructors in this effort. Please consult the March 9 message to instructors for specific information about available resources for remote instruction and final exams. We encourage all instructors to email students in their courses immediately to let them know their course plans. 
As instructors plan for Spring quarter, course materials of all types should be placed on Canvas. Laboratory and studio courses for which remote instruction is not possible can meet in person, although we continue to advise minimizing in-person meetings. More guidance on Spring quarter teaching will be provided as soon as possible.
In closing, we thank you for all that you are doing to support our campus community—and especially our students—during this challenging period. Thank you, all, for your commitment to the well-being of our community.",Santa Cruz
10-Mar-20,999,"Operational changes in response to COVID-19 virus
To: UC Santa Cruz campus community
From: Sarah Latham, Vice Chancellor, Business and Administrative Services
March 10, 2020
Share this story:TwitterFacebookLinkedInReddit
As outlined earlier this morning by Chancellor Larive, UC Santa Cruz is making adjustments to the delivery of classes and the administration of final exams in response to the COVID-19 virus. While we do not have a confirmed case on campus, there are confirmed cases in Santa Cruz County, and we are working to be proactive in supporting the health and safety of our campus community.

In addition to the adjustments in instruction and final-exam administration, and consistent with consultation with our campus emergency management experts, we are making the following adjustments and recommendations related to campus operations. This guidance applies to all campus locations. There could be additional guidance that applies to locations outside of Santa Cruz County should local circumstances warrant it. Note that this guidance is based on the situation as we know it today. Some recommendations may adjust as conditions change. Continue to check for online updates. In addition, questions can be sent to publicaffairs@ucsc.edu. Finally, we will be hosting online town halls to provide further guidance and answer questions you might have about the campus response. Information about those online town halls will be forthcoming.

Sanitation
We are proactively implementing a plan to provide a higher level of sanitation for campus public areas such as building entries, lobbies, restrooms, classrooms, teaching laboratories, libraries, dining halls and other spaces where a large number of people are present or pass through daily. In addition, we are working to expand the locations and number of hand-sanitizing stations across campus. We are also expanding educational information posted across campus outlining the actions all members of the community can take to promote sanitary environments.

Telecommuting
Where feasible, and until at least April 3, supervisors and managers should encourage telecommuting. For positions where telecommuting is not possible, managers and supervisors should work with staff to ensure they have guidance on how to deal with personal health or issues arising from an illness in their family. To ensure staff do not feel compelled to come to work while ill due to a concern about a lack of sick leave balance, UC has issued new guidance on paid leave and remote working provisions. This guidance can be found online.

Travel
Effective immediately, we are recommending the following adjustments to campus travel taking place through April 3. These changes may be expanded beyond that date should conditions warrant.

All non-essential business-related staff and faculty travel that is scheduled to take place prior to April 3 should be canceled. The determination of essential will be up to the principal officer overseeing the unit.

Those who are overseeing university-sponsored student trips and programs should assess if changes should be made to travel plans and if cancelation is appropriate based on the logistics of the trip, modality of travel, and the destination. Individuals should consult their principal officers as needed in assessing changes.

In Chancellor Larive’s message, she suggested students who are able to should return to their permanent residence and continue their studies remotely through April 3. Students unable to travel or return home during this time due to conditions in their destination or due to other health considerations where travel poses a risk may remain on campus. There will be dining options available, though some services might be adapted as conditions change.

In addition to the travel guidance outlined here, the previously communicated travel directives outlined by the UC Office of the President remain in effect.

Events taking place on campus or sponsored by campus
For all events scheduled to take place prior to April 3, we recommend the following:
Cancel events with an anticipated in-person attendance over 50. This number is consistent with guidance from the Santa Cruz County Health Department. This includes events where the university is providing space to an outside host.
For campus-sponsored events with fewer than 50 attendees, we strongly encourage planners of those events to explore alternatives to in-person gatherings.
Campus tours, yield events, and other visitor programs should be canceled and sponsors should consider offering online or virtual campus outreach where feasible and appropriate for program outcomes.
Arts performances and lectures where social distancing is not possible and/or where attendees are likely to travel from other regions of the state, country or globe should be canceled. Performances and lectures that are tied to instruction and/or final exams should follow the guidance provided in the earlier messages from Chancellor Larive and iCPEVC Kletzer.
This event guidance could be extended past April 3 if conditions warrant. In addition, units should cease booking any new campus events scheduled for March and April where event characteristics match those outlined above.

Campus meetings
Where possible, campus departments should utilize Zoom (or alternative services) for meetings to reduce travel on campus or between campus locations. For in-person meetings, social distancing practices should be followed. The guidance above related to gatherings involving more than 50 participants should also be used when making determinations about meeting alterations and cancelations.

Research business continuity
Principal officers should ensure that PIs have updated their continuity plans to deal with research needs, such as dealing with sensitive materials in labs that require oversight, in the event the PI becomes ill or the campus has to further curtail operations. The Office of Research has been working to support this and is engaged with researchers to assist in this effort.

In addition to the items outlined above, our campus emergency response team, in partnership with units across campus, continues to work daily to ensure our response plans are robust in the event we have a confirmed case of COVID-19 on campus or face escalation of illness in our city and county. Our primary focus is ensuring we can support the health and safety of our campus community.

Thank you for your support as we undertake these operational changes.",Santa Cruz
11-Mar-20,1206,"A message to managers and supervisors addresses several temporary changes UC Santa Cruz is making to its regular human resources policies to ensure the campus is maximizing the safety of community members while continuing to deliver on the educational and research mission.
COVID-19 Guidance for supervisors and managers
To: UC Santa Cruz Managers and Supervisors
From: Grace McClintock, AVC, Academic Personnel Office, and Steve Stein, AVC, Staff Human Resources
March 11, 2020
Share this story:TwitterFacebookLinkedInReddit
Working during this unusual time in response to the COVID–19 emergency requires flexibility and modifications to our normal practices. This message addresses several temporary changes we are making to our regular human resources policies to ensure we are maximizing the safety of our community members while continuing to deliver on our educational and research mission.
Principal officers have been asked to provide guidance to their teams that is in alignment with the functions of their respective divisions. Our campus is also following system-wide guidance from the Office of the President (OP) (Guidance from OP) that is described below.
We need to maintain many regular operations while much of our instruction is being transitioned to an online format. Your support is critical to providing increased “social distancing” and other healthy practices. Modifications to an employee’s regular work location, assignments, and schedule should be considered on a case by case basis by the responsible manager.
These five (5) important temporary system-wide emergency provisions now apply at our campus until further notice:
Employees unable to work due to their own or a family member’s COVID–19 illness should use available leave balances (e.g. sick leave, vacation, PTO-sick, or other accrued leave), and if all available leave balances have been exhausted, the University will provide up to fourteen (14) days paid administrative leave to cover the absence. Supervisors/managers are required to submit a Request for Paid Administrative Leave for each employee who needs paid administrative leave.
Employees unable to come to work due to public health or University-required quarantine or self-isolation measures may work remotely if operationally feasible, as determined by the supervisor. If remote work is not operationally feasible, employees should use available leave balances (e.g. sick leave, vacation, PTO-sick, or other accrued leave), and if all available leave balances have been exhausted, the University will provide up to fourteen (14) days paid administrative leave to cover the absence. Supervisors/managers are required to submit a Request for Paid Administrative Leave for each employee who needs paid administrative leave.
Employees unable to come to work due to a COVID–19 day care or school closure that requires them to be home with their child may work remotely if operationally feasible; if remote work is not operationally feasible, employees may use available leave balances (e.g. sick leave, vacation, PTO-sick, or other accrued leave), and if all available leave balances have been exhausted, the University will provide up to fourteen (14) days paid administrative leave to cover the absence. Supervisors/managers are required to submit a Request for Paid Administrative Leave for each employee who needs paid administrative leave.
Managers may designate certain employees to work from home. If employees are designated to work from home, it will be considered paid work status. Employees in positions who are directed not to come to work by the University and are unable to work from home due to the nature of their work (as determined by the manager) should use available leave balances (e.g. sick leave, vacation, PTO-sick, or other accrued leave), and if all available leave balances have been exhausted, the University will provide up to fourteen (14) days paid administrative leave to cover the absence. Supervisors/managers are required to submit a Request for Paid Administrative Leave for each employee who needs paid administrative leave. Managers may determine which positions to designate, provided that all healthcare workers are considered exempt from this category of designation.
Academic appointees who do not accrue sick leave but who are eligible for paid medical leave under APM 710–11 or a collective bargaining agreement may request medical leave for their own illness. For other COVID–19 related absences and for those who have exhausted medical leave options, appointees will receive up to fourteen (14) days paid administrative leave. Requests for medical leave and administrative leave should be directed to the Divisional Academic Personnel Coordinator.
Implementing these five (5) provisions requires managerial judgment, discretion and flexibility depending on the unit’s functional priorities and often based on factors present in a specific case.
We encourage all managers and supervisors to think creatively about how to support all employees, including student employees, in caring for their health – and reducing their risk of exposure to COVID–19 – while enabling them to continue performing their important work. Our employees have different jobs and responsibilities and the modifications we can make to their work will vary based on those differences. There will not be one solution that works for or is right for everyone, and some individuals, due to the nature of their work, will be asked to continue to work on site.
In situations where work can temporarily be performed from home or an alternate location, we encourage managers and employees to work together to identify opportunities to allow employees to work remotely. For all employees, especially those whose work cannot easily be done remotely (including hourly, represented, and student workers), managers and employees should work together to develop a remote work plan to complete special assignments, projects, job-related reading or training. In developing a remote work plan, managers should be mindful of employees who may need alternate work stations set up.
Student employees are not eligible for FMLA. However, student employees are eligible for the fourteen (14) days of administrative leave if they cannot work remotely, self isolate or are exhibiting symptoms of the COVID–19.
Regarding travel, please be conservative in determining travel that is required. It is better to avoid travel than it is to travel. Many UC systemwide meetings are now being canceled or changed to Zoom in order to decrease the need for business travel. Please do not let concerns about non-refundable deposits, etc. lead to travel decisions that put people in more susceptible situations.
Please continue to provide the empathy and patience needed to deal with staff who express concerns. Also, find ways to thank those who have roles requiring them to work onsite. The campus is not closed. We still have people who live on campus, need to deal with facility issues, need to maintain labs and conduct research, and a variety of other duties.
Subject to the needs of the University, managers should consider flexible work arrangements such as having employees work on-site with reduced shifts (fewer hours or fewer days). This can be coupled with remote work assignments for the time not spent on-site.
We appreciate the consideration that has been demonstrated by our community as we continue to work through this unpredictable situation. Campus and UC leaders are continuing to meet daily to think through these issues and are preparing to take the necessary measures to protect the health of our employees. Please contact your Employee Relations Analyst in SHR or your Divisional Academic Personnel Coordinator for guidance or questions about these topics.
",Santa Cruz
