date,word_count,content,school
17-Mar-20,853,"Temporary cessation of non-essential on-campus research operations
To: UC Santa Cruz Research Community
From: Lori Kletzer, Interim Campus Provost and Executive Vice Chancellor & Scott Brandt, Vice Chancellor, Research
March 17, 2020
Share this story:TwitterFacebookLinkedInReddit
As you know, we are in the midst of a dangerous global pandemic and the County of Santa Cruz has issued a Shelter in Place Order for all residents. For the safety of our campus community, we are now in the process of winding down all but essential on-campus operations. Late last week we sent out an email to all researchers about our Research Continuity with COVID-19 webpage, in which we recommended that faculty and researchers take certain steps to prepare for a possible campus shutdown. We are writing now to require that all labs follow that guidance and, as spelled out further below, obtain approval for any research projects and key research personnel you believe must remain active on campus during this time. Until further notice, all projects and personnel not approved are required to wind down on-campus research operations by the end of the week. For the purposes of this communication, on-campus refers to all research operations at UCSC locations within a jurisdiction with a Shelter in Place Order.

Even where research is deemed essential, we need to reduce the density of people working in UCSC research spaces. All principal investigators must communicate with trainees and other lab members about preparation for the shutdown of all non-critical research activities.

We understand that the long-term viability of many research programs during this period will require management of essential animal lines, equipment, liquid nitrogen stocks, and certain long-term experiments. To meet these needs, each laboratory (or neighboring group of laboratories) must identify 1-2 key personnel who will be responsible for any essential ongoing maintenance.

When determining the appropriate size of your lab’s “skeleton crew,” please also consider any equipment that might require gas or cryogen monitoring/service, such as deep-storage freezers, electron microscopes, mass spectrometers, and incubators. Keep in mind that any potentially hazardous operation will require at least two trained and qualified persons be present. We are providing a “Lab Ramp-Down Checklist” that was assembled by EH&S and the Office of Research. It should be noted that in a campus curtailment, there will be limited EH&S support and their response capabilities may be diminished.

Our mouse facilities have been in direct communication with laboratories and have procedures in place to deal with curtailed operations. Individual labs using aquatic or avian species are expected to maintain basic animal care and husbandry operations, and labs with USDA-covered animals that require specialized lab care or intensive husbandry operations are expected to continue providing this care. 

For all key personnel, it has been mandated that everyone practice good hygiene and social distancing, in part by coordinating with others to minimize time on campus and to avoid being in the lab or animal facilities at the same time as others.

To continue their research at home, laboratory members should be encouraged to work on writing projects, literature review, data analysis, or online learning (coding, statistics, etc.). Be sure that lab members are well equipped to work remotely.

If there are essential personnel necessary for the continuation of ongoing critical experiments, instrument maintenance or animal care, you will be required to request permission using this Essential Research Exception Request form. The form will be routed to your Department Chair, Dean, and VCR for approval. Only those meeting the criteria below will be approved.

Criteria for essential personnel

1) Necessary to ensure the ongoing viability of research, including the well-being of research animals and other not easily replaceable perishable research materials.

 Examples:
- Vivarium staff
- Non-vivarium lab staff responsible for animal care
- Greenhouse staff
- Faculty/research staff necessary to maintain other not easily replaceable perishable research materials. This could be primary cell lines or long-term experiments that there would be considerable cost and/or time associated with requiring the experiment to end. (For example, if there has been a continual one-month experiment that has been on-going that requires regular measurements or maintenance to maintain otherwise all previous data is lost).

2) Responsible for maintenance of equipment that, if not done, could result in damage or high cost to equipment.

Examples:
- Cryogen fill on the NMR spectrometer

3) Conducting experiments that have a small time window for completion.

Examples: 
- Time-sensitive experiments with not easily replaceable perishable research materials
- Experiments with a specific measurement that can only take place a few times a year

4) Conducting critical COVID-19 research.

5) Necessary for other critical research/lab-related functions not covered under the above definitions whose presence can prevent danger or significant damage to facilities or research activities.

We completely understand that these restrictions are difficult for you and your laboratory personnel. Our focus at this time is on maintaining safety while avoiding catastrophic damage to people’s research and careers. We hope you appreciate the full magnitude of this crisis and understand that these short-term setbacks will lead to a better outcome for our entire community.

Please direct any questions about this policy to researchcontinuity@ucsc.edu.",Santa Cruz
18-Mar-20,769,"In order to dramatically reduce the density on campus, UC Santa Cruz strongly urges students who can safely leave to do so by Sunday, March 29. This will allow the remaining students who are not able to leave campus the recommended space for effective social distancing. By March 20, undergraduate, graduate, and residents of Family Student Housing need to either complete an Intent to Vacate form or a Remain in Residence form.
Staff Human Resources and the Academic Personnel Office provides guidance about how the campus implement the executive order on administrative leave for academic, staff and student employees at UC Santa Cruz.
Campus Housing and Operations Update
To: UCSC Housing Residents
From: UCSC Student Housing Services
March 18, 2020
Share this story:TwitterFacebookLinkedInReddit
Dear Resident,

Action Required by Friday, March 20. Please read below for instructions.

The emergence of COVID-19 is presenting unprecedented challenges for communities all across the country. As COVID-19 mitigation actions escalate across the country, our campus is making additional changes to our operations.

In order to dramatically reduce the density on campus, we strongly urge students who can safely leave to do so by Sunday, March 29. This will allow the remaining students who are not able to leave campus the recommended space for effective social distancing.

ACTION REQUIRED by March 20: Undergraduate, Graduate and Family Student Housing Tenants
Students departing Housing - Complete the Intent to Vacate form (form requires a UCSC account)
Students remaining in Housing - Complete the Remain in Residence form (form requires a UCSC account)
Additionally, students who have already returned to their permanent residence and need to request an extension to remove their belongings at a later date should ALSO complete the Late Checkout form.

More detail below:

Students Moving Out of University Housing
Whether you have already left campus or are planning to soon, please complete the Intent to Vacate form (form requires a UCSC account) by Friday, March 20. If you have already completed this form then you do not need to complete it again.

Students who complete their move-out and/or have submitted their Intent to Vacate notice by Friday, March 20 will be eligible for a full refund of any housing and dining fees for spring quarter. This will also apply to students who need to request a Late Checkout because they are unable to retrieve their belongings and complete the move-out process at this time.

We will process cancellations and make adjustments to student accounts in the order in which move-out process has been completed. We appreciate your patience during this time and advise that you closely monitor your university account (my.ucsc.edu) to see when your charges have been adjusted. Your account will not accrue a housing late fee while we work to process your adjustment.

Additionally, we will not be voiding guarantees for students who cancel their university housing for spring 2020. Therefore, if a student has a guarantee that extends beyond spring 2020, they will retain that guarantee as long as they apply during the April 13-20 Priority Housing Application Period.

Students Remaining in University Housing
If you need to remain in university housing through spring, please indicate that by completing the Remain in Residence form by Friday, March 20.

Students may consider remaining on campus during the Spring Quarter only if they satisfy at least one of the following conditions:
Do not have access to alternate housing
Financial resources do not enable a return to their permanent residence
Personal health or safety considerations prohibit relocation
Permanent residence does not have, and cannot obtain the infrastructure needed to support remote learning
Other extenuating circumstances
As a university, we understand the challenges faced in following public health guidelines to limit close contact with others to slow the spread of coronavirus. Your health and safety are our first priority, and we are taking actions to significantly increase social distancing on our campus.

It is likely we will need to close some of the residential buildings and relocate those students remaining on campus into fewer locations, as well as adjust our housing and dining operations to improve social distancing. These decisions will be made once we have determined how many students have a need to remain in university housing.

Thank you for your patience and flexibility as we work to keep students and the UCSC community healthy and safe.

You can find additional information on the following sites:
UCSC Main Site: https://www.ucsc.edu/coronavirus/index.html
Housing: https://housing.ucsc.edu/covid-19/index.html
Dining: https://dining.ucsc.edu/covid-19/index.html

Sincerely,
Student Housing Services
Colleges, Housing and Educational Services (CHES)",Santa Cruz
18-Mar-20,1530,"Administrative leave with pay
To: UC Santa Cruz Employees
From: Grace McClintock, AVP/APO and Steve Stein AVC/SHR
March 18, 2020
Share this story:TwitterFacebookLinkedInReddit
Guidance for Employees and Supervisors Regarding the Use of Paid Administrative Leave Pursuant to President Napolitano’s Executive Order Dated March 16, 2020
The University of California has modified the emergency temporary leave policies issued on March 9th in accordance with an Executive Order issued by President Napolitano on March 16th granting paid administrative leave to university employees who are impacted by the COVID-19 emergency. This message provides guidance about how we will implement the Executive Order (EO) for academic, staff and student employees at UC Santa Cruz.

This remains a very fluid situation, and the guidance below may be updated as new information becomes available. Managers and supervisors are encouraged to provide as much flexibility as possible to employees needing to take leave.

All Employees
Effective immediately, all employees (including staff, academic and student employees) will be eligible to receive up to 128 hours paid administrative leave in order to cope with the impact of the COVID-19 pandemic.
The Paid Administrative Leave may only be used for the following purposes:
When an employee is unable to work due to the employee’s own COVID-19-related illness or that of a family member;
When an employee is unable to work because the employee has been directed not to come to the worksite for COVID-19-related reasons and/or the work site has implemented a COVID-19-related remote-work program or is under a shelter in place order and it is not operationally feasible for the employee to work remotely;
When an employee is unable to work because a COVID-19-related school or daycare closure requires the employee to be at home with a child or dependent, and it is not operationally feasible for the employee to work remotely or in conjunction with the dependent care commitment.
The allocation for employees with less than full time appointments shall be prorated based on appointment percentage
The 128 hours may be used consecutively in one block or incrementally
In making the determination as to whether to grant the leave, supervisors must take into account the operational needs of the University with special consideration given to the critical importance of maintaining the continuity of medical center operations
Employees may still use accrued sick, vacation or paid time off in order to address their own illness or the serious medical condition of a family member.
The Paid Administrative Leave may be used prior to usage of other accrued leave.
Paid Administrative Leave can be used retroactively to March 1, 2020.
Subject to the University’s ongoing operational needs, the paid administrative leave provided pursuant to the Executive Order must be used no later than December 31, 2020.
Paid Administrative Leave is available for any new employees hired during the duration of President Napolitano’s March 16, 2020 Executive Order.
An employee who separates from the employment of the University before December 31, 2020 will lose eligibility for Paid Administrative Leave; there is no “cash-in” value connected to the leave.
Employees who are essential to on-campus operations may be required to come to work to ensure educational and business continuity. Managers and employees are encouraged to work together to formulate plans for shift coverage in these essential operational areas to ensure social distancing practices are being followed.

Staff Employees

All individual staff employees are eligible for administrative leave with pay. However, individuals who do not meet one of the three criteria described in the EO for using administrative leave with pay will need to cover unplanned absences with accruals. Additionally, supervisors are required to approve the administrative leave with pay, and such approval will be based on operational necessity to continue essential services.

At this time, formal telecommuting agreements are not being used for COVID-19 related remote work. Supervisors and managers should exercise discretion in determining whether individuals may take home university property to complete work from home. If university property, such as laptops, keyboards, or other items, are brought home by employees, supervisors are encouraged to log equipment serial numbers to track which items are being used in employee homes.  

Individual staff members who meet one of the four criteria for administrative leave outlined in the executive order shall enter the appropriate number of hours into CruzPay. Employees will select “Admin Leave with Pay” and indicate “COVID” in the note section on their timesheet on that day.   

Supervisors and managers will need to work with their employees before approving timesheets to ensure administrative leave with pay is used appropriately for one of the four criteria. Once timesheets are approved, the administrative leave will be paid according to the hours entered into individual time records. The campus is no longer requiring use of the administrative leave with pay form to complete the request for administrative leave with pay for COVID related reasons.

Part time employees are eligible for the 128 hours of administrative leave with pay, prorated based on their percent of time and regularly scheduled hours of work. Administrative leave with pay should be recorded according to the employee’s hours of work and should not exceed their part time schedule. 

Employees who are currently on an approved leave of absence (not related to COVID-19) should continue to record your sick leave and/or vacation leave as discussed in your leave consultation.  If your circumstances have changed, due to COVID-19, please work directly with your Leave Coordinator.

Hourly Student Employees

Student employees are eligible for the 128 hours of administrative leave, prorated based on their percent of time and regularly scheduled hours of work. Administrative leave with pay should be recorded according to the employee’s hours of work and should not exceed their part time schedule. 

Individual student employees who meet one of the four criteria for administrative leave outlined in the executive order shall enter the appropriate number of hours into CruzPay. Student employees will select “Admin Leave with Pay” and indicate “COVID” in the note section on the timesheet.   

Supervisors and managers will need to work with their student employees before approving timesheets to ensure administrative leave with pay is used appropriately for one of the COVID related reasons. Once timesheets are approved, the administrative leave will be paid according to the hours entered into individual timesheets. The campus is no longer requiring use of the administrative leave with pay form to complete the request for administrative leave with pay for COVID related reasons.

Academic Employees

Paid Administrative Leave is available for all academic appointees, policy-covered and represented, for the COVID-19-related reasons described in President Napolitano’s March 16, 2020 Executive Order.

Use of Paid Administrative Leave must not adversely affect the delivery of essential university services. The delivery of instruction is an essential university service. Faculty who are unable to continue delivering instruction should immediately notify their department chair.

Employees who report time or absences in CruzPay should record Paid Administrative Leave on their timesheets. Employees will select “Admin Leave with Pay” and indicate “COVID” in the note section on the timesheet on that day. When approving timesheets, supervisors are affirming that Paid Administrative Leave is being used in accordance with the Executive Order.
For exempt academic employees, Paid Administrative Leave only needs to be reported for full-day absences; a day is defined as the regular time that an appointee would have worked on that day. For such exempt employees, there will be up to 16 days on which the Paid Administrative Leave would occur.
For non-exempt hourly employees, Paid Administrative Leave should be reported on the timesheet in hourly increments. Non-exempt employees are eligible for the 128 hours of administrative leave with pay, prorated based on the appointment percentage.
For faculty and academic student employees who do not complete timesheets (TAs, GSIs, and GSRs), Paid Administrative Leave of 16 days or less should be arranged with the chair/ supervisor. Employees must notify their department chair or faculty supervisor and divisional academic personnel coordinator if they anticipate an absence of more than 16 days, whether consecutive or intermittent. Divisional academic personnel staff will advise employees and supervisors about all available paid leave options on a case by case basis. Divisional staff may consult with the Academic Personnel Office as needed.

Paid medical leave policies in the Academic Personnel Manual (APM 710) and respective collective bargaining agreements (Academic Researchers, Postdocs, Academic Student Employees, Non-Senate Instructional Unit, and Librarians) that are currently available for an appointee’s own illness will extend to cover all COVID-19 qualifying situations, including to care for a family member’s COVID-19 illness, and/or when working remotely is not operationally feasible and the appointee is directed or is under a public order to not to come to work. These extensions of academic policy are in place for the duration of President Napolitano’s March 16, 2020 Executive Order.

Paid Administrative Leave is not available for academic appointees in courtesy or without-salary appointments.

Deans retain the authority to provide leave with pay to academic employees for other good cause as delegated in CAPM 900.700.

For academic employees who are currently on leave, have by-agreement appointments, or for other questions, please consult with your Divisional Academic Personnel Office.",Santa Cruz
