date,word_count,content,school
22-Mar-20,488,"The Financial Aid Office shared an update with students about potential financial aid adjustments.

March 22 - Financial Aid and Spring Housing Adjustments Email
 
Dear Student,
We appreciate your patience as we work as quickly and carefully as possible during this unprecedented challenge to provide you with information and resources in support of your educational goals.
As communicated in messages from Campus Housing, students who have completed the process to fully vacate their on-campus residence by required deadlines will receive a credit for housing and dining fees assessed or paid for spring quarter. These adjustments to your housing and dining charges may result in increased financial aid refunds for financial aid recipients (see the Financial Aid and Scholarship Office message of March 18 and the linked COVID-19 website).
The processing of housing and dining credits will be on-going throughout the next few weeks. Staff in Financial Aid are working in parallel, adjusting aid as quickly as possible, with some student financial aid refunds delayed as work proceeds. In spite of these efforts, it is anticipated there will be some students who will see multiple financial aid refunds or receive additional billing due to the processing timeline. As compared to the normal spring budget for students commuting from home or living with parents, the new remote student budget includes an additional $2,000. The additional budget items are intended to address expenses such as housing, food, technology setup for remote instruction, medical and other costs you may incur during the spring term.
Students may receive financial aid refunds, through direct deposit or checks from Student Business Services, when the total accepted aid is greater than expenses billed by the campus (such as for tuition and fees, on-campus housing and dining, and USHIP). For on-campus students, such financial aid refunds may be modest or may not exist. Changing to the new remote student budget may change your financial aid refund.
For students who normally receive financial aid refunds, the amounts will vary depending upon accepted aid and remaining charges on the student account. An example of the possible change in refunded amounts for a $0 Expected Family Contribution (EFC) California (CA) Resident student is below:
$0 EFC CA Resident, On-Campus Triple Room 5-day meal plan with USHIP
Total Spring Direct Cost/Billing: $10,332
Total Spring Aid : $10,332 (includes $1,167 loan)
Estimated Spring Refund $ 0
 
$0 EFC CA Resident, Remote Instruction with USHIP
Total Spring Direct Cost/Billing: $5,670
Total Spring Aid : $9,145 (includes $1,167 loan)
Estimated Spring Refund $ 3,475
Spring disbursement of financial aid is scheduled for March 23, with direct deposit refunds on March 25 and paper check processing occurring on March 31. While our offices are working as quickly as possible to resolve financial aid and housing adjustments, there may continue to be activity on your account in the following weeks.
Thank you again for your patience,
Financial Aid and Scholarships Office
",Santa Cruz
27-Mar-20,716,"Chancellor Cynthia Larive announced that a student living off campus tested positive for COVID-19
Emergency notification: Confirmed case of COVID-19 at UCSC
To: UC Santa Cruz Community
From: Chancellor Cynthia Larive and Vice Chancellor for Business and Administrative Services Sarah Latham
March 27, 2020
Share this story:TwitterFacebookLinkedInReddit
We write to share that the Santa Cruz County Health Services Agency confirmed today that a student member of the UC Santa Cruz community has tested positive for COVID-19. The student lives off campus and has been self-isolating since being tested. The student was last on campus March 16 and is doing well. 
We are coordinating closely with local public health officials and following the Centers for Disease Control and Prevention (CDC) and California Department of Public Health (CDPH) guidance in responding to this case. Student Health Services and Office of Emergency Services personnel are working with public health officials to determine whether there are members of the campus community who may have had significant exposure to this individual and who may subsequently have an increased risk of developing COVID-19. Public health officials will determine specific actions that may be needed, such as self-quarantine. 
The health and well-being of our campus community is our top priority. The campus is ensuring that this student is getting the care and support that they need. Student Health Services and Office of Emergency Services personnel continue to proactively identify individuals with potential COVID-19 exposure and request that they self-quarantine to protect our community. 
Students, faculty, and staff should stay home and call their health care provider if they have symptoms of respiratory illness, especially fever and cough. The CDC’s coronavirus self-checker is a good tool to help you determine what next steps should be taken.
What students should do
Students, whether on campus, off campus in Santa Cruz, or at their permanent residence, can call the Student Health Center at 831-459-2591 for instructions on self-care or to make a telehealth or in-person appointment. Information about after-hours care for students is available online. Acutely ill students who are not in Santa Cruz should seek medical care from a healthcare provider in their area.
If you are a student who received care off-campus and have tested positive, or if you have been exposed to someone who has tested positive, please notify the Student Health Center at 831-459-2591 so that we can help coordinate your care and support the health of our campus community.
What employees should do
Employees should seek medical care through their regular health care providers. If you have tested positive for COVID-19, or were exposed to someone who tested positive, please email your supervisor and the Office of Emergency Services (Lisa Ehret, director) at oes@ucsc.edu.
Where you can find updates and additional information
The COVID-19 situation is dynamic, which means guidance from public health officials and the CDC changes frequently. The COVID-19 campus website is being updated regularly with the latest information, including the number of confirmed cases in Santa Cruz County and our campus community. Notification about additional confirmed cases of COVID-19 within our campus community will be based on guidance from public health officials.
We appreciate everyone’s cooperation and patience during this challenging time. 
Steps to stay healthy 
The CDC provides the following guidance on how to protect yourself: 
Clean your hands often:
Wash your hands with soap and water for at least 20 seconds especially after you have been in a public place, or after blowing your nose, coughing, or sneezing.
If soap and water are not readily available, use a hand sanitizer with at least 60% alcohol. Cover all surfaces of your hands and rub them together until they feel dry.
Avoid touching your eyes, nose, or mouth with unwashed hands. 
Avoid close contact with others:
Avoid close contact with people who are sick.
Put distance between yourself and other people (at least 6 feet).
Take steps to protect others:
Stay home, except for essential business/services as covered in the state’s stay-at-home order.
Cover coughs and sneezes:
Cover your mouth and nose with a tissue when you cough or sneeze or use the inside of your elbow.
Throw used tissues in the trash.
Immediately clean your hands.
Wear a facemask if you are sick and around other people.
Clean and disinfect frequently touched surfaces. ",Santa Cruz
29-Mar-20,914,"Notice of mandatory housing relocation
Notice of Mandatory Housing Relocation
To: Campus Housing Residents
From: UCSC Student Housing Services
March 29, 2020
Share this story:TwitterFacebookLinkedInReddit
In response to COVID-19, UC Santa Cruz has taken steps to dramatically and immediately reduce the number of people living on campus. Students who can return to a permanent address or make alternate housing arrangements have been encouraged to leave campus. However, we understand that leaving campus may not be an option for everyone and we are committed to supporting our students through this outbreak.
In order to focus our staffing and support services on the needs of a smaller residential population on campus, we will be relocating the following residents:
Students living in residence halls
Students living at the Camper Park, Village, or University Town Center
Students living in apartments at Cowell College, Redwood Grove, and the Porter Apartment Buildings F and G
Students will be relocated to College Nine, College Ten, Crown College, or Merrill College. It is our goal to:
Reassign apartment residents to the apartments at one of the above communities.
Reassign residence hall residents to the residence hall facilities at one of the above communities. These housing areas are in proximity to one of the two campus dining halls that we currently plan to keep open (College Nine/College Ten Dining Hall and Crown Dining Hall).
Moving assistance will be provided. This will include moving bins, supplies such as cardboard boxes and tape, as well as movers and trucks to transport your belongings to your new housing assignment.
Housing staff are currently working on your new housing assignment. You will soon receive a message with information about your new room assignment and instructions for completing your move. To be clear, this move is mandatory and we appreciate your cooperation. Note: special attention is being placed on students with disability-related needs to ensure the new housing assignment will meet their individual needs.
In order to maximize efficient use of housing space, while also implementing appropriate physical distancing for residents, each room will be assigned as a single. Students will not be negatively financially impacted by this change to single occupancy residency. Instead all residential students will be charged the triple room rate for spring quarter. Additionally, students on the 5-day meal plan for spring quarter will be upgraded, at no additional cost, to the 7-day plan to ensure dining access during the weekends. Students already on the 7-day plan for spring quarter will receive a rate reduction to the cost of the 5-day plan. Apartment residents who wish to obtain the 7-day meal plan at the 5-day plan cost may do so.
You are receiving this letter because you have indicated that you plan to remain in residence this spring. We want you to know the latest information so that you can make an informed decision about your housing situation to the extent that you have choices. If you can make alternate housing arrangements, we strongly urge you to do so. If you do plan to leave campus, please complete the Intent to Vacate form to indicate your intention to move-out of university housing as soon as possible. We will continue to offer a full housing refund for spring quarter to students who give their intent to vacate and complete their move-out by April 19.
Based upon the current public health information available, the following details the conditions we anticipate in our residential buildings during spring quarter. Please keep in mind that this is an evolving situation and circumstances may change further.
We are doing all we can to prevent the spread of COVID-19. However, the virus has already become so prevalent that public health authorities believe that if testing were more widely available, it would reveal that many of us, including UCSC students and employees, have already been exposed to this virus.
The primary public health strategy is mitigation: reducing exposure by rigorous compliance with physical distancing recommendations, cessation of group gatherings, regular handwashing and extra care to avoid unnecessary contact with our most vulnerable populations. This is most effective when followed by all of us as individuals. However, we want to prepare you for the reality that some people residing in as well as staff supporting campus housing will inevitably become ill with COVID-19.
It is also inevitable that students who become sick with COVID-19 but are not ill enough to require hospitalization will need to self-isolate in campus residences. Students who are exposed to the virus before they realize it will be living in some proximity to students who are well, increasing the potential for the virus to spread.
We will close several of the residential buildings and relocate any students residing there, as well as adjust our housing and dining operations to improve physical distancing.
Any resident who remains on campus for spring should be prepared to be relocated (possibly more than once) so that we may create spaces for isolation as well as quarantine.
Dining Services will be limited to take-out only meals.
We appreciate that this information may add to your anxiety during what is an already stressful time. It is our goal to share as much information as we have as quickly as possible so you can make decisions that are right for you.
Since you are planning to remain in residence during spring, please begin to prepare yourself for relocation, and follow instructions that will follow from your Housing/Student Life Office.
Sincerely,
Student Housing Services",Santa Cruz
31-Mar-20,419,"Vice Provost Jaye Padgett encouraged faculty and staff to continue employing students to the fullest extent possible during this period of COVID-19.

Supporting student employees during period of COVID-19
To: UC Santa Cruz Staff and Faculty
From: Vice Provost Student Success Jaye Padgett
March 31, 2020
Share this story:TwitterFacebookLinkedInReddit
Dear Staff and Faculty Colleagues,
COVID-19 has created unprecedented challenges for us. Among those many challenges is the question of whether and how we can continue to employ students. I’m writing with thoughts related to this question.
For many students, whether they are eligible for work-study or not, a campus-paid job is part of their financial aid plan. The prospect of losing income now because of COVID-19 could create hardship, possibly even endangering their ability to continue as students. I have already heard from students who are deeply concerned over the possible loss of income, and who starting spring quarter may be unable to pay for rent and buy groceries. Obviously, challenges like this disproportionately affect our students who are historically underserved, a barrier to our goal of equity of outcomes.
In addition to sustaining a student financially, employment is also a key part of the student experience, engaging them and contributing to student professional development. Now more than ever, continuing to provide engagement and developmental experiences would be helpful to our students.
For all of these reasons, for those of you who have been employing students, I encourage you to continue doing so to the fullest extent possible during this period of COVID-19.
There are many ways of employing students even remotely. Students can complete special assignments, projects, or job-related reading or training. Now could be a great time to catch up on projects and tasks that we often delay because of our busy work days. I encourage you to be creative in offering work to our students to help mitigate the impact of losing income. Our FAQ page on student employment (see below) offers more ideas. (Please note, however: students should not be assigned work or hired into positions that would otherwise be completed by career employees if career employees need additional hours to fulfill their appointment percentages.)
We recognize that you may have many questions about hiring students given our new realities. For example, can Work Study students be employed remotely? Answer: Yes! To help you get answers, we have created this FAQ page. We will continue to improve it, and we welcome your feedback on it.
Thanks for everything you’re doing to support our students.
",Santa Cruz
1-Apr-20,896,"Updated guidance on campus operations based on extended Shelter in Place Order issued by the Santa Cruz Health Department
Moving services to pack and ship belongings
UC temporarily adjusts admissions requirements to help students, families in wake of COVID-19  Read an FAQ for fall 2020 admitted students

Updated guidance on campus operations based on extended Shelter in Place Order issued by the Santa Cruz Health Department
To: UC Santa Cruz Community
From: Sarah Latham, Vice Chancellor Business and Administrative Services
April 01, 2020
Share this story:TwitterFacebookLinkedInReddit
The UC Santa Cruz community continues to navigate the challenges of the COVID-19 pandemic. We are being proactive in maximizing physical distancing, while maintaining the critical operations needed to support students and employees who continue to live on campus, to facilitate remote learning, and to ensure the campus infrastructure is maintained and campus facilities are safe. The COVID-19 situation continues to be dynamic. Not only does it impact campus operations, but it has impacted the personal lives of everyone in the campus community and across the globe. Thank you for your cooperation and patience as we navigate the situation and collectively work to mitigate the spread of the virus.
Over the last few weeks, we have outlined the steps we are taking during this public health crisis in several campus messages. Our actions have adapted over time as we learn more and as we comply with federal, state and local mandates, as well as guidance coming from the UC Office of the President. Yesterday, the Santa Cruz County Health Department issued a new order extending the current shelter in place mandate until May 3 and outlining additional clarifications on allowable activities. They also issued a useful FAQ that addresses questions members of the Santa Cruz community have. 
Our campus continues to be defined in the directive as an essential institution and activities we undertake for purposes of facilitating remote learning or performing essential functions are allowable, provided that physical distancing of six-feet per person is maintained to the greatest extent possible.
Below is an update on the latest information on campus operations. Please note that some restrictions that had been put in place until April 7 will now continue through at least May 3 to comply with new county orders. For additional information, you can access the UC Santa Cruz COVID-19 website.
Dining Services
Dining Services will be operating the College Nine/College Ten Dining Hall and Crown/Merrill Dining Hall during the spring quarter as a take-out only service.  Additional information is available at the Dining COVID-19 Response page.
Campus Housing
Students living in campus housing have been asked to return to their permanent residences if conditions allow. The housing office is relocating students who remain on campus in an effort to maximize physical distancing, while also ensuring staff can adequately support those who remain. Additional information can be found at the Housing COVID-19 page.
Campus Events
Guidance was given in earlier communications that campus events and events hosted in/on campus facilities should be canceled or postponed through the remainder of the spring quarter. No new events should be scheduled for the spring quarter. Event sponsors can contact the Office of the Campus Counsel to discuss considerations for event contracts. Information on commencement and guidance on summer event planning will be forthcoming.
Campus Travel
All campus travel scheduled to take place prior to May 3 that does not comply with current shelter-in-place directives should be canceled or postponed. All non-essential business should be canceled or postponed for the rest of the spring quarter. Principal officers will provide guidance on any needed exceptions, though they must comply with other local and federal travel guidelines.
Employees and Leave Options
Earlier this month, directives for employees and for research and instructional staff were shared to clarify expectations for working at and physically accessing campus locations. Principal officers have oversight of their divisions in determining the minimum staff members needed to maintain critical on-campus operations. The new COVID-19 administrative pay program launched earlier this month is still in effect and those leave hours can be used prior to December 31, 2020 to support employees unable to work due to COVID-19 related reasons. Staff Human Resources has developed an FAQ site to answer many questions related to staff employment during the COVID-19 pandemic. Academic employees may refer to the Academic Personnel Office’s COVID-19 information site. 
Research Activities
The Office of Research has been coordinating research continuity planning across divisions. Additional information is available online. Principal officers can provide division-specific guidance on how research should be handled during the shelter in place.
Remote Instruction
The Center for Innovations in Teaching and Learning is offering resources and essential information for instructors at the Keep Teaching site.  
Library
Both the McHenry Library and the Science and Engineering Library will be closed until further notice. Services that involve accessing or exchanging physical items will not be offered. All patron-facing services will focus solely on online or remote options. More information about resources and contacts are available at the Library Remote Access webpage.  
Bookstore
The bookstore remains closed to walk-in shopping. Online orders for all products can be placed for pickup at the will call window or may be shipped, free of charge. The Express Store will remain open but will follow stringent social distancing guidelines and limit the number of individuals allowed inside at any time. More information can be found at the Bay Tree Bookstore site.
Outdoor Recreation
As outlined in the Santa Cruz Health Department order, outdoor recreation activities, including walking, hiking, bicycling, and running, must be in compliance with physical distancing, which is six feet of distance from other individuals.",Santa Cruz
1-Apr-20,388,"Moving Services to Pack and Ship Belongings
To: Housing Group
From: UCSC Student Housing Services
April 01, 2020
Share this story:TwitterFacebookLinkedInReddit
Dear Student,
If you have already left campus and are unable to return to retrieve your belongings personally, you may need to contract with a personal moving service to pack your belongings and ship them to you. Many services are available, and focus on university students who need their rooms packed and their belongings shipped or stored. One option for shipping and/or storage of your belongings is Dormbox*, though there are other moving companies and you are encouraged to research your options.
As stated in our previous communication, students who complete their move-out (i.e. remove all belongings and return any university keys) by April 19 will be eligible for a full refund of any housing and dining fees paid for spring quarter. Anyone who is still in residence after this date, or whose belongings remain in residence, will be charged for the period of time from the start of the quarter to the date their move-out is completed.
If you cannot retrieve your belongings by April 19, Dormbox is available to pack and ship/store your belongings before this deadline. Dormbox is scheduled to be at UCSC this Saturday 4/4 as well as Saturday 4/18 to assist students—students can be present, or not.
Signing up with Dormbox is easy:
1. Register with Dormbox. Provide your name, email, and phone number.
2. Provide Dormbox with information about where you’re living at UCSC.
3. Select a date and time preference for Dormbox to pack your belongings.
4. Complete your order and reserve your time.
Contact Dormbox with any additional questions you may have.
Disclaimer: Any reference obtained from this site to a specific product, process, or service does not constitute or imply an endorsement by UC Santa Cruz or the University of California of the product, process, or service, or its producer or provider. Neither UC Santa Cruz, the University of California, nor any of their employees, makes any warranty, express or implied, including warranties of merchantability and fitness for a particular purpose, or assumes any legal liability for the accuracy, completeness, or usefulness of any information from the links from this site, or the product, process or service or its producer or provider.",Santa Cruz
