link,date,content,school
https://www.unt.edu/notices/covid-19-update-5,27-Mar-2020,"One of the cases that will be included in the Denton County case counts being released soon will include one of our UNT students, who had traveled to New Orleans for spring break. The individual lives in an apartment in the city of Denton and has been quarantined since being evaluated and tested for COVID-19 by a healthcare professional.

Timekeeping update: Record any COVID-19-related work since March 13 on your timesheet using the specially designated codes “REGER – Regular Earnings Emergency” or “RHWER – Regular Hours Worked Emerg” for salaried and hourly employees, respectively. Learn about UNT time reporting guidelines for this COVID-19 crisis.

For faculty and staff who are helping students during this difficult time, City of Denton officials urge you to remind students about the following:

How to file for unemployment.
No evictions or utility shut offs are occurring right now. Students can call 940-349-8700 to discuss their utility accounts.
Any other financial matters that might be common across students at this time.
Here are some helpful tips from the City of Denton.

Going above and beyond: Stories from UNT’s COVID-19 response:

Associate Professor of Mathematics Pieter Allaart wants to give a shoutout to Department Chair and Professor Ralf Schmidt:

Ralf joined our department only this past fall from another institution, but he very quickly earned the trust of our faculty, staff and graduate students and, before the “coronacrisis” hit, had already started transforming the department in a positive way. But these last few weeks, his calm and steady leadership has truly made a difference. Day by day, he kept everyone informed with clear emails detailing step by step what we needed to do next, sometimes even with a measured dose of humor. He also constructed a webpage with helpful tips for teaching online. Moreover, he went out of his way to ensure that all instructional personnel had the necessary resources to start teaching online, ordering tablets, webcams and document cameras for whoever needed them, and with his physical presence he kept up morale among the staff who had to keep coming into the office until the very last moment when the department was already a ghost town. Thanks to Ralf's leadership, the Mathematics Department experienced a remarkably smooth transition.

If you know of someone who is going above and beyond, please share their information with untpresident@unt.edu so we can give them a shoutout!",University of North Texas
https://www.unt.edu/notices/covid-19-update-4,26-Mar-2020,"As we are all getting more comfortable with our new telecommute reality, please remember we have tips available at Work Anywhere orTeach Anywhere. If you are new to all the Zoom and video conferencing, Tech Republic published a great article with some practical tips titled “13 etiquette tips for video conference calls.”

Are you using virtual backgrounds for your Zoom calls? If so, click here to see new, university-branded photography that is available to upload for your meetings.

Reminder: If you have been identified as essential personnel during this period of time, please carry your UNT identification card with you at all times. UNT Police may ask to see your ID as they work to ensure that only students, faculty and staff are on campus.

University Mail Services will continue to operate during the current COVID-19 crisis and will be open in the University Services Building (Room 128) 8 a.m. to 5 p.m. daily Monday through Friday.

Mail will be delivered in the morning daily to those departments remaining on campus.

Departments that are closing may request that their mail be held until the crisis is resolved. At that time, it will be delivered as normal. Departments also may designate someone to pick up their mail at Mail Services. Please call 940-565-2286 or email mail.services@unt.edu to schedule time for pickup and Mail personnel will bring it to your car.

In addition, Central Receiving is open regular hours Monday through Friday.

Going above and beyond: Stories from UNT’s COVID-19 response:

From Frances Perkins, principal lecturer and department advisor, Department of Media Arts:

The staff in the Media Arts department have gone above and beyond since the first moments of this unusual situation. They have been present in person while the faculty and adjuncts have been able to work remotely, handling student workers, keeping all operations going (including the TV and radio stations), and then having to shut down the department physically by yesterday afternoon. This included cleaning out refrigerators and planning how mail would be delivered. All of this happened during the retirement of one staff member and the change of department chairs. Our staff have been on the front line, so to speak, and we the faculty of the Media Arts department cannot express enough our gratitude for their hard work and dedication.

Our amazing staff include:

Mark Dobson – Media Technical Manager
Martin Dzurenko – Chief Engineer TV
Laura Flowers – CLASS Undergraduate Advisor
Mark Lambert – KNTU Station Manager
Marielena Resendiz – Student & Program Assistant
Randy Smith – Chief Engineer Radio
Lesa Statler – Administrative Specialist
Adam Van Fossen – Assistant Media Technical Manager
Velma White – Administrative Coordinator",University of North Texas
https://www.unt.edu/notices/covid-19-update-meeting-your-needs-while-you-stay-home-official-notice-president,25-Mar-2020,"Dear Mean Green students and parents,

On Tuesday, officials from Denton County and the City of Denton announced a ""stay-at-home"" order beginning at 11:59 p.m. today, Wednesday, March 25. UNT already had announced a campus transition to essential operations only, which began at 5 p.m. yesterday, March 24.

We must all take this ""stay-at-home"" order to heart. It is essential for the health and safety of our community that we reduce our population density to slow the spread of this virus.

Students living in residence halls must comply with the ""stay-at-home"" order. The order allows students to leave their residence only for essential activities, such as grocery shopping, picking up meals from campus dining, visiting a healthcare professional, or engaging in outdoor activity such as walking, hiking, running or riding a bicycle – with proper social distancing.

We understand that for some students, UNT is their home and, as such, we have an added responsibility to ensure their health and safety on our campus. We will continue to maintain specific, essential, on-campus services for students who need them, including:

Meal service for our on-campus residents will be provided with to-go options from Kerr Cafeteria.
The Union is closed with the exception of Eagle Post, which is open 9:30 a.m. to 2:30 p.m. Monday through Friday.
For students feeling anxiety or stress, Counseling Services remain available.
Willis Library will remain open from 10 a.m. to 4 p.m. for UNT faculty, staff and students with UNT ID. Many UNT Library services also are available.
The Student Health and Wellness Center will maintain regular hours with the exception of a noon to 1 p.m. daily closure for lunch.
The Food pantry is closed. Please reach out to the Denton Community Food Center for assistance.
All other university services, and campus access for non-campus residents, have moved to virtual service only.
We are in uncharted territory as we face this global pandemic together. I am amazed every day by the support, resilience and ingenuity displayed by our students, staff and faculty when every hour seems to bring more change, more necessary adaptations, and more uncertainty.

As difficult as it may feel in this moment, we are becoming a stronger, more connected community through this shared experience. Someday soon we will be together again to live, learn and play. Until then, stay together in spirit and unity of purpose as the Mean Green family I am so very proud to call my own.

Sincerely,
Neal Smatresk
UNT President",University of North Texas
https://www.unt.edu/notices/covid-19-update-3,25-Mar-2020,"On Tuesday, officials from Denton County and the City of Denton announced a shelter-at-home order effective at 11:59 p.m. today (March 25). The order means that area residents can only leave their homes to shop for necessary items, and it also closes all non-essential businesses.

A limited number of UNT employees have been identified as essential for serving students who remain on campus and continuing critical business operations of the university, and they are allowed to be on campus. UNT Police ask that you always carry your university ID during this time.

As a reminder, UNT employees who do not fall into the essential personnel category for being on campus and are unable to do their work from home – as determined by your vice president and supervisor – will be reassigned to other duties or receive emergency leave. Please visit this UNT System website to learn more about COVID-19-related emergency leave.

Many of our students are facing great hardships as their on- and off-campus jobs are eliminated or drastically scaled-back or their families face uncertain times. Please consider a gift of any amount to help support our UNT students.

Visit: https://one.unt.edu/untcares.

UNT System Chancellor Lesa Roe hosted a COVID-19-related Town Hall Tuesday, March 24, with UNT President Neal Smatresk, UNT Dallas President Bob Mong, UNT Health Science Center President Michael Williams, and Vice Chancellor & Chief Human Capital Officer Barbara Abercrombie.

The video is archived and can be here.

Going above and beyond: Stories from UNT’s COVID-19 response

UNT student Kelly Schmidt wants to give a shout out to her supervisor, Brecken Wellborn, at the Learning Center. Kelly wrote the following:

“He is the director of Tutoring Services and has been working overtime to keep all his student employees connected, safe, and up-to-date during this scary time. Transitioning all of the Learning Center's tutoring services to online offerings in the space of a week and coordinating the changing schedules of 10 different tutors and their appointments was a huge task, but he has managed it amazingly well. I think all of my fellow employees would agree that he goes above and beyond for UNT and for us, and that he deserves some recognition.”

If you know of someone who is going above and beyond, please share their information with untpresident@unt.edu so we can give them a shout out.

Reminder: Employees (non-exempt and exempt) who are working in direct response to the current health situation, as directed and approved by your supervisor, and/or employees who are performing emergency response work (e.g. essential personnel) in direct response to the current health situation, must record the time worked on the response differently. Please review important timekeeping information procedures whether you are working direct response or not..

",University of North Texas
https://www.unt.edu/notices/covid-19-update-working-together-through-change-official-notice-president,24-Mar-2020,"Dear UNT students,

Yesterday, we went live with more than 7,700 classes that transitioned from face-to-face to online. I want everyone to understand that it was an amazing effort and our faculty and staff deserve a big round of applause for their hard work in getting us to this point. Of course, no change as fast and sweeping as this goes off without a hitch, and we expect technical, logistic, and human error issues as we all work through this change together.

In particular, we might anticipate bandwidth limitations from some of our third-party providers, as well as challenges in the homes of our students and faculty as they teach and learn anywhere. So, I ask your forbearance as we work through the many small and large challenges that we will be facing this week. We will do our best to iron them out and will make sure that classes will proceed, and students can complete their semester.

If you are experiencing difficulty or have questions, please reach out online.

Our resilience is a key attribute of the Mean Green family and, working together, we are going to get the job done!

Remember to keep yourself and your families healthy, keep a positive attitude, and follow our updates at https://healthalerts.unt.edu.

Sincerely,
Neal Smatresk
UNT President",University of North Texas
https://www.unt.edu/notices/covid-19-update-2,24-Mar-2020,"The campus will transition to only essential operations and we will move all other campus offices to virtual service today, March 24, at 5 p.m.

UNT employees who do not fall into the essential personnel category for being on campus and are unable to do their work from home – as determined by your vice president and supervisor – will be reassigned to other duties or receive emergency leave. Please visit this UNT System website to learn more about COVID-19-related emergency leave.

Employees (non-exempt and exempt) who are working in direct response to the current health situation, as directed and approved by your supervisor, and/or employees who are performing emergency response work (e.g. essential personnel) in direct response to the current health situation, must record the time worked on the response differently. Please review important timekeeping information procedures whether you are working direct response or not.

Reminder: UNT World Town Hall hosted by Chancellor Lesa Roe begins at 2 p.m. today. The all-virtual town hall will feature a moderated Q&A with Chancellor Roe and include UNT President Neal Smatresk, UNT Dallas President Bob Mong, UNT Health Science Center President Michael Williams, and Vice Chancellor & Chief Human Capital Officer Barbara Abercrombie.

Faculty and staff can watch live. The video will be archived at the same URL.

University Mail Services will continue to operate during the current Covid-19 crisis and will be open in the University Services Building (Room 128) 8 a.m. to 5 p.m. daily Monday through Friday.

Mail will be delivered in the morning daily to those departments remaining on campus.

Departments that are closing may request that their mail be held until the crisis is resolved. At that time, it will be delivered as normal. Departments may also designate someone to pick up their mail at Mail Services. Please call 940-565-2286 or email mail.services@unt.edu to schedule time for pickup and Mail personnel will bring it to your car.

Don’t forget that healthalerts.unt.edu is updated frequently with new information about how we are working together through this global health crisis.",University of North Texas
https://www.unt.edu/notices/covid-19-update-1,23-Mar-2020,"Today, we went live with more than 7,700 classes that transitioned from face-to-face to online. We know there likely will be issues, and we will be watching very closely to help address those as they occur. In particular, we might anticipate bandwidth limitations from some of our third-party providers, and challenges in the homes of our students and faculty as they work to teach and learn anywhere. We are here to help. If you are experiencing difficulty or have questions, please reach out online.

Getting this number of courses online and ready to go this week was a huge achievement, and it took all of our faculty and staff working practically nonstop the last several days so that we could continue to serve our students.

A big thank you goes to Ryan Boettger, assistant professor and assistant chair in Technical Communication, for all the prep work he did to convert TECM 2700 to an online format. This course has 750 students and requires coordinating 20 adjuncts and TFs to deliver it, and he did all the updating and prep work. He’s an example of the herculean efforts in the College of Liberal Arts and Social Sciences. We want to hear your stories!

If you know of someone who is going above and beyond, please share their information with untpresident@unt.edu so we can give them a shout out!

As part of the efforts to keep you informed, Chancellor Lesa Roe is hosting a virtual UNT World Town Hall beginning at 2 p.m. Tuesday, March 24. The town hall will feature a moderated Q&A with Chancellor Roe, all three UNTS presidents – our very own UNT President Neal Smatresk, Bob Mong (UNT Dallas), and Michael Williams (UNTHSC) – and Vice Chancellor & Chief Human Capital Officer Barbara Abercrombie.

Faculty and staff can watch live. The video will be archived at the same URL.

Helpful information:

Faculty: Making your Online Class Accessible
Students: Using Zoom within Canvas for Video Communication
In addition, Provost Jennifer Cowley is hosting Coffee Hours on a variety of topics:
Continuity of Teaching – 3 p.m. Thursday, March 26 with Zoom Code: 133010949
Continuity of Academic Student Services – 11 a.m. Thursday, March 26 with Zoom Code: 790456656
Continuity of Research – 4 p.m. Monday, March 23 with Zoom Code: 170163294",University of North Texas
https://www.unt.edu/notices/covid-19-update-your-safety-our-priority-official-notice-president,22-Mar-2020,"Dear Mean Green students and parents,

In response to the additional cases of Coronavirus (COVID-19) in our region of the state, UNT is moving to only essential personnel on campus. We are currently identifying employees who are needed in order to serve UNT students that choose to remain in our residence halls and also those dealing with critical business functions of the university.  The safety and health of our students and entire university community is our primary focus.

Important takeaways for you:

Residence halls and dining services – with social distancing in mind – will stay open for those who wish to remain in our care. The Student Health and Wellness clinic also with social distancing in place will be open.
For those who choose to leave the residence halls, please continue to use the check-out sign-up form.
The UNT Food Pantry in Crumley Hall is open 10 a.m. to 5 p.m. Monday through Friday.
We have moved all of our support services to an online format to serve our students, whether they are living on-campus or completing coursework afar. These options include email, telephone and Zoom or other video chat services.
Student employees are being directed to reach out to their supervisors directly to discuss telecommuting and other options.
For general questions and concerns, please reach out to the Parent and Family Hotline at 844-366-5892. The hotline is available 10 a.m. to 2. p.m. on Saturdays and Sundays and 8 a.m. to 8 p.m. Monday through Friday.

For further questions regarding housing or dining, please call 940-565-2610. Regular hours are 8 a.m. to 5 p.m. Monday through Friday, but staff will be available 9 a.m. to 3 p.m. this Sunday, March 22.

As stated before, this is a rapidly evolving situation, and we will continue to keep you updated.

We are working diligently to safeguard our community as best we can while continuing to fulfill the university’s primary mission to serve our students. Thank you for your continued support and understanding as we navigate these unprecedented times.

Sincerely,
Neal Smatresk
UNT President",University of North Texas
https://www.unt.edu/notices/covid-19-update-begin-moving-essential-personnel-only-campus,22-Mar-2020,"Dear Faculty and Staff,

As vice presidents finalize staffing plans to keep only essential personnel on campus, I am instructing them to expedite the process for identifying those who will be needed to serve remaining UNT students in residence halls and serve critical business continuity functions. The campus will transition to only essential operations and we will move all other campus offices to virtual service delivery by 5:00 p.m. Tuesday, March 24.

UNT employees who do not fall into the essential personnel category for being on campus and are unable to do their work from home – as determined by your vice president and supervisor – will be reassigned to other duties or receive emergency leave through Friday, April 3. If health-related restrictions have not changed, the length of emergency leave will be evaluated at that time. Please visit this UNT System website to learn more about COVID-19-related emergency leave.

On Monday, March 23, we are also discontinuing most, but not all, in-person appointments for students and transitioning to virtual options where possible. Those options include email, telephone, and Zoom or other video chat services.

The Student Health and Wellness clinic is among the services that will continue face-to-face appointments, along with dining and residence hall services – with social distancing in mind. I should note that prospective students will also be able to utilize nearly all virtual options.

We began this intense effort to support our community’s safety by extending spring break and moving classes online. It has been truly amazing to watch the teamwork by faculty and staff as we moved quickly to take care of each other and our students. We have also taken measures to ensure that our resident students are not unilaterally displaced, rather that we continued to provide a safe haven for those with the need or desire to remain in our care.

It is my hope that these immediate changes will further safeguard our community as much as possible while continuing to fulfill the university’s primary mission to serve our students.

Sincerely,
Neal Smatresk
UNT President",University of North Texas
https://www.unt.edu/notices/covid-19-update-housing-and-dining,20-Mar-2020,"Dear Mean Green Parents and Families,

We have been actively listening to our community as we navigate this rapidly evolving global health crisis and have made the following decisions.

Residence Halls and Dining Services will remain open for those who choose to stay in their residence hall to complete their course work remotely for the remainder of the semester. We understand some of our students have nowhere else to go at this time, and we continue to find ways to increase social distancing and implement additional deep cleaning measures.

Beginning March 23, students who choose to leave university housing and complete their coursework elsewhere will be given a prorated housing refund based on their move-out date. Any remaining dining credits will be applied to a dining plan of choice for the 2020-2021 academic year.

If your student plans to move out of housing, please contact the front desk staff of their residence hall to schedule a move-out time. Additional information can be found here. For further questions regarding your housing or dining account, please call 940-565-2610. Regular hours are Monday-Friday 8 a.m. to 5 p.m., but hours are extended this evening (March 20) until 7 p.m. On Saturday and Sunday, staff will be available from 9 a.m.-3 p.m.

For general questions and concerns, please reach out to the Parent and Family Hotline at 844-366-5892 Monday-Friday from 8 a.m. to 8 p.m. and 10:00 a.m. to 2:00 p.m. Saturday-Sunday.

Please accept our thanks for your understanding as we continue to navigate this unprecedented time with what is best for our students’ academic success and future graduation from UNT.",University of North Texas
https://www.unt.edu/notices/covid-19-update-commencement,20-Mar-2020,"Dear Mean Green family,

We are living through an unprecedented global event the likes of which we have rarely seen in the 130-year history of our university. The personal impact on each of us and our normal routine on and off campus is great, which is why I am writing to share news about Commencement with you today.

After much consideration, I have decided to postpone Commencement ceremonies that were scheduled for May 7-10. Our spring commencement is the last major event to be impacted, and the decision was not made quickly in order to thoroughly consider whether we could begin returning to normal operations in early May. While we should all remain optimistic about where we could be with the fight against coronavirus (COVID-19) in 45 days, families of May graduates need to know now whether to make travel arrangements.

I know that crossing the stage is a defining moment for our students who have worked so hard to earn their degree(s), so please know that many people across campus are currently reviewing ways to still allow commencement to happen later in the year for any graduate wishing to participate. Whatever is decided, spring graduates will have an opportunity to participate in an in-person ceremony and cross the stage at a commencement ceremony, but you will officially graduate regardless of whether we hold a ceremony or not. As soon as we make a decision regarding these later ceremony options, we will share that information with our community.

For students who still need answers regarding our transition to online instruction, including such topics as the availability of laptops and textbooks, please visit our frequently asked questions page on the healthalerts.unt.edu website.

Thank you for your patience as we work together to allow our students to complete the current semester over the coming weeks. I understand that this is a difficult time for them, their families, and our faculty and staff, but we are pulling together and solving problems as they arise in a way that demonstrates our caring and creative UNT spirit.

 

Sincerely,
Neal Smatresk
UNT President",University of North Texas
