link,date,content,school
https://www.unt.edu/notices/covid-19-update-18,15-Apr-2020,"In tracking time during the current health situation, UNT System HR has found that some employees without the ability to telecommute or work are not entering emergency leave, and the time is reflecting as regular hours worked.

Any staff member:

whose job is not conducive to telecommuting;
has not been designated as essential personnel to work on campus; and
has no alternative duties assigned
(meaning that they are unable to work because the university has directed them not to) must enter HPEMG – Health Pandemic Emergency Leave for their time, whether they are unable to work a full or partial day. This time reporting of emergency leave began March 25, the first date the campus was closed to nonessential personnel, as all staff should have been able to be on campus to perform their jobs prior to that date.

It is imperative that supervisors ensure that staff in their areas who are in the situation listed above are using the timecode HPEMG, as leave time cannot be reflected as regular pay for work performed.

As areas across the country begin to see a decline in COVID-19 cases, it’s important to continue to take precautions to prevent the spread of the virus. These reminders include updated information from the Centers for Disease Control.

Washing your hands and practicing social distance of 6 feet or more from others remain the most effective ways to prevent the spread. Masks and gloves are recommended by the CDC in specific situations. On campus, Facilities continues to clean common rooms and general building areas. It is recommended that you sanitize your own desk or work station, as needed.

Going above and beyond: Stories from UNT’s COVID-19 response:

The Department of Mathematics wants to celebrate Kristi Nelson, manager of the Math Quest Center, for perfectly exemplifying UNT’s commitment to building community. Nelson has tirelessly and competently been answering the phone and handling e-mails throughout this crisis.

While we were still allowed on campus, Kristi single-handedly and in record time turned the Math Quest Center into a socially distanced computer lab for students who wouldn't have internet access, complete with a detailed cleaning schedule for the workstations. She kept track of many things, from equipment requests to remote teaching forms, time reporting and more. Kristi also mixed together her own cleaning materials when we weren't able to buy it anymore. As the last woman standing in an otherwise deserted department, she even delivered teaching equipment and other items to people — or met them in the Walmart parking lot — after work! She traveled as far as Keller to make sure all employees had what they needed to succeed remotely. Above all, Nelson kept her colleagues’ spirits up with some great office humor. “The list goes on, but we are just so thrilled to share the type of employees we have working here at UNT,” says Jana Watkins, office manager and assistant to the chair. “Math rocks! We bleed green!”

If you know of someone who is going above and beyond, please share their information with untpresident@unt.edu so we can give them a shoutout.",University of North Texas
https://www.unt.edu/notices/help-so-you-can-succeed-message-president,15-Apr-2020,"Dear UNT students,

As educators, our purpose is you. We spend every day focused on helping each of you thrive, and we revel in your creativity, tenacity and brilliance. Our world has been shaken and that calls for a change in how we support you. We recognize that one of the biggest burdens many students are facing right now is financial insecurity. In an effort to ease some of the economic strain you may be experiencing, I want to let you know how UNT is trying to help.

First, we have made changes to the cost of enrolling in summer courses. For summer 2020 sessions, students will not have to pay some of the typical mandatory fees that help fund several support services on campus. This includes waivers of the Recreational Facility Fee, Student Union Fee, Medical Services Fee, Transportation Fee and Athletics Fee. We are able to do this because we have moved all in-person classes scheduled for the May session, Summer I and full summer sessions to online/remote delivery. Students can take advantage of these summer sessions and reduced costs to save money and stay on track to graduate on time.

Second, as you may already be aware, the federal government has provided a boost in student aid through the CARES Act. This funding allows us to greatly expand our emergency grants-in-aid program. This need-based aid is available for currently enrolled students as well as students who enroll in UNT summer sessions. The funds are intended to help students pay their bills and stay in school so they can earn their degrees as planned.

Applications for the emergency grants-in-aid program can be completed at https://tinyurl.com/UNTStudentSuccessFA. And, you can learn more about the cost of summer sessions by contacting Student Financial Services at sfs@unt.edu, online chat at sfs.unt.edu or by calling 940-565-3225.

I realize that emergency aid and fee waivers won't solve every problem. Times are tough, but so is our Mean Green Family. We will keep working on creative solutions to unprecedented problems. We will keep finding fresh ways to bring you the world-class education you deserve. You won't have to make it through these tough times alone. We're here to help you thrive because that's what we do.

UNT proud, 
Neal Smatresk
UNT President",University of North Texas
https://www.unt.edu/notices/covid-19-update-17,14-Apr-2020,"The current global crisis has negatively impacted our students’ finances, and every effort is being made to provide them with relief. As a result, UNT will not be charging students for some mandatory fees for summer sessions that support services delivered on the campus, including waiver of the Recreational Facility Fee, Student Union Fee, Medical Services Fee, Transportation Fee and Athletics Fee due to the COVID-19 health crisis.

Students can take advantage of this opportunity to save money and stay on track to graduate on time. Student Financial Services can provide additional information by email at sfs@unt.edu, online chat at sfs.unt.edu or phone at 940-565-3225.

Because the COVID-19 situation has made it impossible for some staff members to continue their work on campus since what they do cannot be performed remotely, and because we recognize the importance of cultivating our internal talent, we will be advertising some critical staff positions internally prior to opening them to the public. Effective Tuesday, April 14, all staff job openings, which are approved to be opened during the current hiring freeze, will be posted for the UNT community to review for five days prior to opening to external applicants. This will allow our current employees the opportunity to review and apply for positions before individuals outside of the university. To view internal job postings:

Login to my.untsystem.edu
Click on “Applicant Tracking and Position Management” in the center of the page<.li>
Login again using EUID and password
Click on “Apply for a Job”
Click on “Search Internal Jobs”
Going above and beyond: Stories from UNT’s COVID-19 response:

Kassie Grubbs, budget officer for the Division of Student Affairs, wants to thank April Barnes, Phyllis Vaughn and Elizabeth With for their incredible work throughout the COVID-19 crisis.

Associate Vice President for Budget and Analytics April Barnes was extremely helpful and patient when Grubbs needed to get up-to-speed on the situation upon her return from vacation. Barnes has been very responsive to emails and Skype messages despite having a lot on her plate. Her entire team in the budget office has been very helpful in answering questions and concerns. Grubbs also thanks Phyllis Vaughn for being an excellent resource and partner for gathering ad hoc data when requested. “She always shares tips that help me learn and grow in my own position,” Grubbs says. Finally, Elizabeth With has been tirelessly engaged in DSA’s efforts to spread awareness and improve processes during this trying time. “I don't know how she keeps up, but she always does,” Grubbs says. “Her leadership is uplifting and inspiring not only during this time of crisis but also in her everyday work.”

If you know of someone who is going above and beyond, please share their information with untpresident@unt.edu so we can give them a shoutout.",University of North Texas
https://www.unt.edu/notices/covid-19-update-16,13-Apr-2020,"We know that many of our students are struggling financially through this global health crisis. In order to help students as much as possible, UNT is greatly expanding its emergency grants-in-aid program thanks to federal funding provided by the CARES act. This need-based aid will become available soon for students currently enrolled at UNT and also will be available to students in UNT summer sessions. These funds are meant to help students pay their bills and stay in school so they can earn their degrees as planned. To apply, click here. #UNTCares

The Murphy Center at the G. Brint Ryan College of Business would like to share information regarding external funding resources available to UNT students, faculty, and alumni during these difficult times. On the Murphy Center website, there is a section with a list of external funding opportunities that is updated biweekly.

Going above and beyond: Stories from UNT’s COVID-19 response:

Elizabeth Hageman, Transportation Team Lead in Transportation Services, would like to give a shout out to UNT Community Service Officers who have been working day and night to ensure buildings are locked in the absence of faculty and staff on campus. Both part-time and full-time workers are on the frontline patrolling, on foot, around the clock to keep equipment and buildings secured. Serving as the eyes and ears of campus, we have been able to report suspicious activity to UNTPD and assist community members still on campus. I am proud that our staff has continued to provide needed security to our community during this time.

She also would like to recognize the E-ride shuttle drivers who continue to provide late night shuttle service to residents still on campus. Despite having low ridership, their spirits are still high. Thank you to all of those who continue to provide safe options to our residents on campus!

If you know of someone who is going above and beyond, please share their information with untpresident@unt.edu so we can give them a shoutout.",University of North Texas
https://www.unt.edu/notices/summer-courses-mostly-online-financial-relief-coming-message-president,10-Apr-2020,"Dear Students, Faculty and Staff,

I hope you are all doing well as we continue to innovate and break new ground to promote our students’ success during this challenging time. I appreciate the resilience we have shown as a community — it exemplifies our Mean Green spirit! As we move closer to the end of the spring semester, I want to share our plans for Summer courses, as well as news regarding emergency financial aid to provide assistance to our students during this time.

First, we are moving all in-person classes scheduled for the May session, Summer I and full summer sessions to online/remote delivery. At this time, our hope is that courses scheduled for on campus in Summer II will continue in person, but that could change based on recommendations from health officials and agencies.

In addition, and in recognition of the financial impact COVID-19 is having on our students, we will provide emergency financial relief to many of our students enrolled in summer courses, which will appear on student tuition and fee statements in the coming weeks. We are doing everything possible to find ways to help students continue their education during the summer months.

Here is additional information regarding summer courses:

Summer financial aid is available, including summer Pell Grant awards for eligible students. For more information, please visit https://summer.unt.edu/fund-summer.
Summer 2020 registration is now open.
Registration can be completed online through MyUNT.
For specific information, please refer to the Summer 2020 Registration Guide, which includes key dates.
All Registration and academic record services can be conducted virtually. Please see the Student “How to…” chart at https://registrar.unt.edu/.
I am counting on our creativity, caring and resilience to guide the path for our Mean Green family to get through this global health crisis — and emerge stronger than ever. You are all doing an amazing job, and I thank you for all you have done during these challenging times.

Stay strong and support each other because, no matter the physical distance we are required to maintain, we can remain socially close and connected. #PhysicallyDistantSociallyClose

UNT Proud,
Neal Smatresk
President",University of North Texas
https://www.unt.edu/notices/covid-19-update-15,10-Apr-2020,"Avesta and Kerr Dining Hall continue to serve UNT students and essential personnel who are on campus. Avesta is offering a continental breakfast priced a la carte and the classic lunch menu starting at $7.75 for the Daily Special. Kerr will offer all-you-care-to-eat meals for $7.95 for those without meal plans.

Hours vary so be sure to check www.dining.unt.edu/hours before heading over for your next drink or meal.

And starting Monday, April 13, the Starbucks in the Union will reopen for business from 8 a.m. to 2 p.m. Monday through Friday to serve those remaining on campus.

Going above and beyond: Stories from UNT’s COVID-19 response:

Van Cross of the Facilities Custodial Team works a tough schedule: Way, way before sunrise until lunchtime. He’s been working during the pandemic to sanitize campus buildings, stock restrooms and accomplish small cleaning projects taking advantage of the vacant buildings across UNT.

One recent morning, while preparing for a special cleaning project, he heard dripping water in the Environmental Education, Science and Technology Building and discovered a failed research system pumping water into the building. Mr. Cross notified a stand-by technician to get the leak stopped, contacted his supervisor and manager to rally a team to assist and began gathering and using water extraction equipment.

Van’s attentiveness and quick response saved “many thousands of dollars in clean-up and restoration costs,” according to Randy Salsman of the Facilities Maintenance construction team that is overseeing the recovery and repairs to the building. Associate Vice President of Facilities Dave Reynolds says, “Van Cross is representative of many of the Facilities Team and others across the campus who are unselfishly taking care of our campus and students during a unique time in history. We should all be proud to work with such teammates.”

If you know of someone who is going above and beyond, please share their information with untpresident@unt.edu so we can give them a shoutout.

Sharing Mean Green Pride

Student Financial Services continues to show Mean Green Pride by wearing green on Fridays and sharing photos of their team on social media. “It’s a great way to keep up the team spirit and stay connected to UNT. I love the collages they put together to share with everyone,” says Joey Saxon of his team. Saxon is the associate vice president of Student Financial Services.

Don’t forget to sport your Mean Green pride on Fridays! (Or every day!)",University of North Texas
https://www.unt.edu/notices/covid-19-update-14,9-Apr-2020,"The College of Music is sharing this Song for Health with the campus community during this difficult time.

According to Natalie Mannix, D.M.A., associate professor of trombone, musicians around the world are using the hashtag #musicdoesntstop to connect the world through music in support of health care and public service workers at the frontlines. It was started by trombonist Martin Schippers. Steven Verhelst composed the piece the UNT trombone studio recorded free of charge for this purpose. The movement has expanded to include all musicians.

The Division of Digital Strategy and Innovation is excited to announce the launch of the new Coursera for UNT program. All students, faculty and staff members with an @unt.edu email have access to non-credit courses for FREE!

In addition, you also have free access to more than 3,800 offerings from our partnering peer institutions – some of the best in the world – and our colleagues at Coursera. The non-UNT courses are available through September 2020. This provides faculty with immediate access to supplemental (and accessible!) content as they search for high quality online resources for their UNT course.

Going above and beyond: Stories from UNT’s COVID-19 response

Sophilia McTyre, assistant director of TRIO Talent Search, commends Daniel Griffith from AITS for the many years he has supported UNT’s TRIO programs. During these changing times, Danny has worked tirelessly to serve and exceed TRIO’s program needs. Not only did he meet with everyone on an individual basis to ensure that their home office technology needs were met, but he also assisted staff in customizing their many devices to meet their specific needs. During the many phone calls and sessions, he provided stellar service and always maintained a positive attitude. McTyre says, “I know my fellow team members would more than agree that Danny deserves recognition for being our Tech Hero.”

If you know of someone who is going above and beyond, please share their information with untpresident@unt.edu so we can give them a shoutout.",University of North Texas
https://www.unt.edu/notices/covid-19-update-13,8-Apr-2020,"Diversity and Inclusion in the Division of Institutional Equity and Diversity has partnered with the UNT System to provide all UNT World employees multiple online opportunities to explore diversity, equity, inclusion, and access.

Employees can engage with selected webinars from LinkedIn Learning, UNT Bridge, and Diversity and Inclusion’s new “Tele Talks” offerings and receive credit for participation upon completion of reflection questions. In addition to employee professional development, these resources serve as curricular enhancements for class discussions, syllabi, or other instructional tools.

The virtual resources serve as primers for Diversity and Inclusion’s in-person, interactive learning and development sessions which will resume as soon as possible. To request services from UNT’s diversity and inclusion staff to facilitate classroom or other unit discussions using these resources, or an in-person training from their training inventory, visit https://edo.unt.edu/list-available-trainings or email diversity.inclusion@unt.edu.

Want to stay in the know? Follow @DiversityUNT on Twitter! Subscribe to the newsletter here.

Many of our students are facing great hardships due to how COVID-19 is impacting them, especially as their families also face uncertain times. Please consider a gift of any amount to help support our UNT students.

Visit https://one.unt.edu/untcares.

Going above and beyond: Stories from UNT’s COVID-19 response

Brenda Yu wants to give a shoutout to Scott Harris for inspiring his colleagues to support the Denton community during these challenging times. He’s been visiting some of our favorite local restaurants and purchasing gift cards that he can either donate to those in need or use himself once restrictions have been lifted. “We are so blessed to have good jobs,” Harris says. “But while our students are gone, many local restaurants that depend on student traffic to stay afloat are struggling. Let’s help keep the great restaurants near campus and in the Square going for when things return to normal. If you have any other ideas, please share them with all of us. This is the time to pull together. Go MEAN GREEN!”

If you know of someone who is going above and beyond, please share their information with untpresident@unt.edu so we can give them a shoutout.
",University of North Texas
https://www.unt.edu/notices/covid-19-update-12,7-Apr-2020,"Please remember these reminders regarding student, faculty and staff health from UNT’s Student Health and Wellness Center:

Students who are experiencing possible symptoms of COVID-19 or have other health-related questions should contact the Health and Wellness Center at 940-565-2333 during normal business hours (8 a.m. to 5 p.m. Monday through Friday). Students seeking assistance outside of normal business hours can use our virtual resources. Please remember it is best to call ahead for instructions rather than show up at a crowded waiting room while exhibiting symptoms.
Faculty and staff who are experiencing possible symptoms of COVID-19 or have other health-related questions, please contact your primary care physician for further instructions. Please follow all instructions you are given and notify UNT’s Emergency Management and Safety Services staff if you are directed to self-isolate or self-quarantine by your healthcare provider.
Anyone experiencing any type of respiratory symptoms should stay home, self-isolate from other individuals, and avoid the UNT campus for 14 days or until evaluated by a healthcare provider.
The Murphy Center at the G. Brint Ryan College of Business would like to share information regarding external funding resources available to UNT students, faculty, and alumni during these difficult times. On the Murphy Center website, there is a section with a list of external funding opportunities that is updated bi-weekly.

For essential personnel on campus, the Center for Leadership and Service is partnering with Carter BloodCare to host a blood drive from 1 to 5 p.m. Thursday, April 9, outside of the University Union. There will be limited spaces available for donation due to social distancing guidelines. In order to donate, you must make an online appointment

Going above and beyond: Stories from UNT’s COVID-19 response:

Professor Trish Kaminski wants to say “brava and bravo” to psychology professors Vicki Campbell and Randy Cox. They have done and continue to do an amazing job transitioning the psychology department and clinic to function remotely. Their dedication and leadership have allowed approximately 40 faculty and staff, 100 graduate students, thousands of undergrads and hundreds of clinic clients to teach, learn and conduct or receive therapy safely during this health crisis.

If you know of someone who is going above and beyond, please share their information with untpresident@unt.edu so we can give them a shoutout.",University of North Texas
https://www.unt.edu/notices/covid-19-update-11,6-Apr-2020,"UNT’s Recreational Sports department has developed a guide for faculty and staff looking for ways to exercise, take a personal break or relieve some stress.

For essential personnel on campus, the Center for Leadership and Service is partnering with Carter BloodCare to host a blood drive from 1 to 5 p.m. Thursday, April 9, outside of the University Union. There will be limited spaces available for donation due to social distancing guidelines. In order to donate, you must make an online appointment.

Registration is open. Please remind your students to stay on track for graduation by registering for the classes they need this summer and fall.

In addition, UNT is serving students virtually in every way we can. If you are interacting with students who need help, please remind them to stay connected through our online services. Details for each office’s services are posted on their websites.

Key services include:

Career Center
Dean of Students
Financial Aid
Registrar
Student Financial Services
Virtual Advising
If you are encountering lighthearted moments right now while working from home with a house full of kids and animals or other predicaments, and you can record those situations, please send them to us. In an effort to collectively share the struggles of teaching and working while isolated, UBSC is continuing to compile those moments, which will be developed into a highlight video.

Share videos through the Dropbox link below and email Angilee Wilkerson (angilee.wilkerson@unt.edu) to make her aware the video is on the way. Please include a sentence or two regarding the video clip, as well as your name and job at UNT. Also, name your clip with your full name. As many as possible will be used.

https://www.dropbox.com/request/9Tt0cUbsZCNoEGuEeqwd
Going above and beyond: Stories from UNT’s COVID-19 response:

Responding to COVID-19 and its impact on our entire campus community has been a herculean effort, but today we are acknowledging a few areas that have been on the front line 24/7 since it began.

In particular, thank you to all staff in Emergency Management, Facilities, Housing and UNT Police for their dedicated service during this global health crisis. Each of these units are supporting critical crisis response and/or business continuity in ways that are not always visible but certainly always necessary.

If you know of someone who is going above and beyond, please share their information with untpresident@unt.edu so we can give them a shoutout.
",University of North Texas
